author,body,categories,industries,characters_count,clusters,entities,hashtags,id,keywords,language,links,paragraphs_count,published_at,sentences_count,sentiment,source,summary,title,words_count,license_type,media
"{'id': 13181733, 'name': 'Wed Apr'}","Webster Financial Corporation (NYSE:WBS), the holding company for Webster Bank, N.A., announced that its Board of Directors declared a quarterly cash dividend of $0.40 per share on its common stock.
 The dividend on common shares will be payable May 16, 2024, to shareholders of record as of May 6, 2024.
  On its Series G Preferred Stock, Webster declared a quarterly cash dividend of $16.25 per share ($0.40625 per each depositary share, 40 of which represents one share of Series G Preferred Stock), payable July 15, 2024, to shareholders of record on June 30, 2024.
  About Webster
  Webster Financial Corporation (NYSE:WBS) is the holding company for Webster Bank, N.A. Webster is a leading commercial bank in the Northeast that provides a wide range of digital and traditional financial solutions across three differentiated lines of business: Commercial Banking, Consumer Banking and Healthcare Financial Services, one of the country's largest providers of employee benefits and administration of medical insurance claim settlements solutions. Headquartered in Stamford, CT, Webster is a values-driven organization with $76 billion in assets. Its core footprint spans the northeastern U.S. from New York to Massachusetts, with certain businesses operating in extended geographies. Webster Bank is a member of the FDIC and an equal housing lender. For more information about Webster, including past press releases and the latest annual report, visit the Webster website at
   View source version on businesswire.com:
  © 2024 Barchart.com, Inc. All quote data is provided and hosted by Barchart Market Data Solutions. Fundamental company data provided by Morningstar and Zacks Investment Research. SEC Filings provided by Edgar Online. Information presented is provided 'as-is' and solely for informational purposes, not for trading purposes or advice, and is delayed. No representations are made by Barchart as to its informational accuracy or completeness. To see all exchange delays and to review Barchart's full Terms and Conditions and Disclaimer, please see Barchart's User Agreement","[{'id': 'IAB13', 'label': 'Personal Finance', 'score': 0.37, 'links': {'self': 'https://api.aylien.com/api/v1/classify/taxonomy/iab-qag/IAB13'}}, {'id': 'IAB13-11', 'label': 'Stocks', 'score': 0.13, 'links': {'parents': ['https://api.aylien.com/api/v1/classify/taxonomy/iab-qag/IAB13'], 'self': 'https://api.aylien.com/api/v1/classify/taxonomy/iab-qag/IAB13-11'}}, {'id': '04000000', 'label': 'economy, business and finance', 'score': 0.05, 'links': {'self': 'https://api.aylien.com/api/v1/classify/taxonomy/iptc-subjectcode/04000000'}}, {'id': '04019000', 'label': 'finance (general)', 'score': 0.05, 'links': {'parents': ['https://api.aylien.com/api/v1/classify/taxonomy/iptc-subjectcode/04000000'], 'self': 'https://api.aylien.com/api/v1/classify/taxonomy/iptc-subjectcode/04019000'}}, {'id': 'ay.biz.dividend', 'label': 'Dividends', 'score': 1, 'links': {'parents': ['https://api.aylien.com/api/v1/classify/taxonomy/aylien/ay.fin.biz', 'https://api.aylien.com/api/v1/classify/taxonomy/aylien/ay.impact'], 'self': 'https://api.aylien.com/api/v1/classify/taxonomy/aylien/ay.biz.dividend'}}, {'id': 'ay.fin', 'label': 'Finance', 'score': 1, 'links': {'self': 'https://api.aylien.com/api/v1/classify/taxonomy/aylien/ay.fin'}}, {'id': 'ay.fin.biz', 'label': 'Business Finance and Financing', 'score': 1, 'links': {'parents': ['https://api.aylien.com/api/v1/classify/taxonomy/aylien/ay.fin'], 'self': 'https://api.aylien.com/api/v1/classify/taxonomy/aylien/ay.fin.biz'}}, {'id': 'ay.fin.invest', 'label': 'Investments', 'score': 1, 'links': {'parents': ['https://api.aylien.com/api/v1/classify/taxonomy/aylien/ay.fin'], 'self': 'https://api.aylien.com/api/v1/classify/taxonomy/aylien/ay.fin.invest'}}, {'id': 'ay.fin.prstock', 'label': 'Preferred Stock', 'score': 1, 'links': {'parents': ['https://api.aylien.com/api/v1/classify/taxonomy/aylien/ay.fin.stocks'], 'self': 'https://api.aylien.com/api/v1/classify/taxonomy/aylien/ay.fin.prstock'}}, {'id': 'ay.fin.stocks', 'label': 'Stocks', 'score': 1, 'links': {'parents': ['https://api.aylien.com/api/v1/classify/taxonomy/aylien/ay.fin.invest'], 'self': 'https://api.aylien.com/api/v1/classify/taxonomy/aylien/ay.fin.stocks'}}, {'id': 'ay.impact', 'label': 'Trading Impact (ICE Codes) Important Corporate Events', 'score': 1, 'links': {'self': 'https://api.aylien.com/api/v1/classify/taxonomy/aylien/ay.impact'}}, {'id': 'ay.fin.comstock', 'label': 'Common Stock', 'score': 0.9, 'links': {'parents': ['https://api.aylien.com/api/v1/classify/taxonomy/aylien/ay.fin.stocks'], 'self': 'https://api.aylien.com/api/v1/classify/taxonomy/aylien/ay.fin.comstock'}}, {'id': 'ay.biz', 'label': 'Business and Commerce', 'score': 0.8, 'links': {'self': 'https://api.aylien.com/api/v1/classify/taxonomy/aylien/ay.biz'}}, {'id': 'ay.fin.sharehld', 'label': 'Corporate Shareholders', 'score': 0.8, 'links': {'parents': ['https://api.aylien.com/api/v1/classify/taxonomy/aylien/ay.fin.biz', 'https://api.aylien.com/api/v1/classify/taxonomy/aylien/ay.impact'], 'self': 'https://api.aylien.com/api/v1/classify/taxonomy/aylien/ay.fin.sharehld'}}]","[{'id': 'in.finserv', 'label': 'Financial Services and Banking', 'score': 1, 'links': {'self': 'https://api.aylien.com/api/v1/classify/taxonomy/industries/in.finserv'}}, {'id': 'in.finserv.banking', 'label': 'Banks and Banking', 'score': 1, 'links': {'parents': ['https://api.aylien.com/api/v1/classify/taxonomy/industries/in.finserv.lending'], 'self': 'https://api.aylien.com/api/v1/classify/taxonomy/industries/in.finserv.banking'}}, {'id': 'in.finserv.lending', 'label': 'Lending', 'score': 1, 'links': {'parents': ['https://api.aylien.com/api/v1/classify/taxonomy/industries/in.finserv'], 'self': 'https://api.aylien.com/api/v1/classify/taxonomy/industries/in.finserv.lending'}}]",2089,[580344569],"[{'id': 'N82926702310560770160669329693378460396', 'types': ['Organization'], 'overall_sentiment': {'polarity': 'neutral', 'confidence': 0.82}, 'overall_prominence': 0.98, 'overall_frequency': 1, 'title': {'sentiment': {'polarity': 'neutral', 'confidence': 0.82}, 'surface_forms': [{'text': 'Webster Financial Corporation Declares Common', 'frequency': 1, 'mentions': [{'index': {'start': 0, 'end': 45}, 'sentiment': {'polarity': 'neutral', 'confidence': 0.82}}]}]}}, {'id': 'Q7978891', 'links': {'wikipedia': 'https://en.wikipedia.org/wiki/Webster_Bank', 'wikidata': 'https://www.wikidata.org/wiki/Q7978891'}, 'stock_tickers': ['WBS'], 'types': ['Business', 'Organization'], 'overall_sentiment': {'polarity': 'neutral', 'confidence': 0.88}, 'overall_prominence': 0.98, 'overall_frequency': 2, 'body': {'sentiment': {'polarity': 'neutral', 'confidence': 0.88}, 'surface_forms': [{'text': 'WBS', 'frequency': 2, 'mentions': [{'index': {'start': 36, 'end': 39}, 'sentiment': {'polarity': 'neutral', 'confidence': 0.83}}, {'index': {'start': 624, 'end': 627}, 'sentiment': {'polarity': 'neutral', 'confidence': 0.92}}]}]}}, {'id': 'Q13677', 'links': {'wikipedia': 'https://en.wikipedia.org/wiki/New_York_Stock_Exchange', 'wikidata': 'https://www.wikidata.org/wiki/Q13677'}, 'types': ['Stock_exchange', 'Organization'], 'overall_sentiment': {'polarity': 'neutral', 'confidence': 0.88}, 'overall_prominence': 0.98, 'overall_frequency': 2, 'body': {'sentiment': {'polarity': 'neutral', 'confidence': 0.88}, 'surface_forms': [{'text': 'NYSE', 'frequency': 2, 'mentions': [{'index': {'start': 31, 'end': 35}, 'sentiment': {'polarity': 'neutral', 'confidence': 0.83}}, {'index': {'start': 619, 'end': 623}, 'sentiment': {'polarity': 'neutral', 'confidence': 0.92}}]}]}}, {'id': 'A6006778', 'types': ['Company', 'Organization'], 'overall_sentiment': {'polarity': 'neutral', 'confidence': 0.85}, 'overall_prominence': 0.98, 'overall_frequency': 3, 'body': {'sentiment': {'polarity': 'neutral', 'confidence': 0.85}, 'surface_forms': [{'text': 'Webster Bank', 'frequency': 3, 'mentions': [{'index': {'start': 66, 'end': 78}, 'sentiment': {'polarity': 'neutral', 'confidence': 0.85}}, {'index': {'start': 656, 'end': 668}, 'sentiment': {'polarity': 'neutral', 'confidence': 0.93}}, {'index': {'start': 1288, 'end': 1300}, 'sentiment': {'polarity': 'neutral', 'confidence': 0.79}}]}]}}, {'id': 'N21852193859667912736195118793248820932', 'types': ['Organization'], 'overall_sentiment': {'polarity': 'neutral', 'confidence': 0.89}, 'overall_prominence': 0.98, 'overall_frequency': 2, 'body': {'sentiment': {'polarity': 'neutral', 'confidence': 0.89}, 'surface_forms': [{'text': 'Webster Financial Corporation', 'frequency': 2, 'mentions': [{'index': {'start': 0, 'end': 29}, 'sentiment': {'polarity': 'neutral', 'confidence': 0.85}}, {'index': {'start': 588, 'end': 617}, 'sentiment': {'polarity': 'neutral', 'confidence': 0.93}}]}]}}, {'id': 'N91425136111319926537141868413893791381', 'types': ['Location'], 'overall_sentiment': {'polarity': 'neutral', 'confidence': 0.88}, 'overall_prominence': 0.98, 'overall_frequency': 2, 'body': {'sentiment': {'polarity': 'neutral', 'confidence': 0.88}, 'surface_forms': [{'text': 'N.A', 'frequency': 2, 'mentions': [{'index': {'start': 80, 'end': 83}, 'sentiment': {'polarity': 'neutral', 'confidence': 0.84}}, {'index': {'start': 670, 'end': 673}, 'sentiment': {'polarity': 'neutral', 'confidence': 0.93}}]}]}}, {'id': 'Q188628', 'links': {'wikipedia': 'https://en.wikipedia.org/wiki/Board_of_directors', 'wikidata': 'https://www.wikidata.org/wiki/Q188628'}, 'overall_sentiment': {'polarity': 'neutral', 'confidence': 0.86}, 'overall_prominence': 0.75, 'overall_frequency': 1, 'body': {'sentiment': {'polarity': 'neutral', 'confidence': 0.86}, 'surface_forms': [{'text': 'Board of Directors', 'frequency': 1, 'mentions': [{'index': {'start': 105, 'end': 123}, 'sentiment': {'polarity': 'neutral', 'confidence': 0.86}}]}]}}, {'id': 'N192484442290441775375564376555541037325', 'types': ['Organization'], 'overall_sentiment': {'polarity': 'neutral', 'confidence': 0.9}, 'overall_prominence': 0.74, 'overall_frequency': 2, 'body': {'sentiment': {'polarity': 'neutral', 'confidence': 0.9}, 'surface_forms': [{'text': 'G Preferred Stock', 'frequency': 2, 'mentions': [{'index': {'start': 321, 'end': 338}, 'sentiment': {'polarity': 'neutral', 'confidence': 0.9}}, {'index': {'start': 483, 'end': 500}, 'sentiment': {'polarity': 'neutral', 'confidence': 0.9}}]}]}}, {'id': 'Q5225233', 'links': {'wikipedia': 'https://en.wikipedia.org/wiki/Darren_Webster', 'wikidata': 'https://www.wikidata.org/wiki/Q5225233'}, 'types': ['Human'], 'overall_sentiment': {'polarity': 'neutral', 'confidence': 0.88}, 'overall_prominence': 0.72, 'overall_frequency': 6, 'body': {'sentiment': {'polarity': 'neutral', 'confidence': 0.88}, 'surface_forms': [{'text': 'Webster', 'frequency': 6, 'mentions': [{'index': {'start': 340, 'end': 347}, 'sentiment': {'polarity': 'neutral', 'confidence': 0.91}}, {'index': {'start': 578, 'end': 585}, 'sentiment': {'polarity': 'neutral', 'confidence': 0.93}}, {'index': {'start': 675, 'end': 682}, 'sentiment': {'polarity': 'positive', 'confidence': 0.77}}, {'index': {'start': 1082, 'end': 1089}, 'sentiment': {'polarity': 'positive', 'confidence': 0.51}}, {'index': {'start': 1381, 'end': 1388}, 'sentiment': {'polarity': 'neutral', 'confidence': 0.84}}, {'index': {'start': 1460, 'end': 1467}, 'sentiment': {'polarity': 'neutral', 'confidence': 0.84}}]}]}}, {'id': 'N139111846989366155038572370195683755592', 'types': ['Human'], 'overall_sentiment': {'polarity': 'neutral', 'confidence': 0.74}, 'overall_prominence': 0.34, 'overall_frequency': 3, 'body': {'sentiment': {'polarity': 'neutral', 'confidence': 0.74}, 'surface_forms': [{'text': 'Barchart', 'frequency': 3, 'mentions': [{'index': {'start': 1906, 'end': 1914}, 'sentiment': {'polarity': 'neutral', 'confidence': 0.69}}, {'index': {'start': 2006, 'end': 2014}, 'sentiment': {'polarity': 'neutral', 'confidence': 0.74}}, {'index': {'start': 2070, 'end': 2078}, 'sentiment': {'polarity': 'neutral', 'confidence': 0.77}}]}]}}, {'id': 'Q1389504', 'links': {'wikipedia': 'https://en.wikipedia.org/wiki/Morningstar,_Inc.', 'wikidata': 'https://www.wikidata.org/wiki/Q1389504'}, 'stock_tickers': ['MORN'], 'types': ['Company', 'Business', 'Organization'], 'overall_sentiment': {'polarity': 'neutral', 'confidence': 0.91}, 'overall_prominence': 0.02, 'overall_frequency': 1, 'body': {'sentiment': {'polarity': 'neutral', 'confidence': 0.91}, 'surface_forms': [{'text': 'Morningstar', 'frequency': 1, 'mentions': [{'index': {'start': 1661, 'end': 1672}, 'sentiment': {'polarity': 'neutral', 'confidence': 0.91}}]}]}}, {'id': 'Q963227', 'links': {'wikipedia': 'https://en.wikipedia.org/wiki/Southeastern_Conference', 'wikidata': 'https://www.wikidata.org/wiki/Q963227'}, 'types': ['Organization'], 'overall_sentiment': {'polarity': 'neutral', 'confidence': 0.92}, 'overall_prominence': 0.02, 'overall_frequency': 1, 'body': {'sentiment': {'polarity': 'neutral', 'confidence': 0.92}, 'surface_forms': [{'text': 'SEC', 'frequency': 1, 'mentions': [{'index': {'start': 1704, 'end': 1707}, 'sentiment': {'polarity': 'neutral', 'confidence': 0.92}}]}]}}, {'id': 'N249225933987928815812879274809947927665', 'types': ['Organization'], 'overall_sentiment': {'polarity': 'positive', 'confidence': 0.76}, 'overall_prominence': 0.02, 'overall_frequency': 1, 'body': {'sentiment': {'polarity': 'positive', 'confidence': 0.76}, 'surface_forms': [{'text': 'Commercial Banking', 'frequency': 1, 'mentions': [{'index': {'start': 850, 'end': 868}, 'sentiment': {'polarity': 'positive', 'confidence': 0.76}}]}]}}, {'id': 'N173860697195809391947603679952358378287', 'types': ['Organization'], 'overall_sentiment': {'polarity': 'neutral', 'confidence': 0.84}, 'overall_prominence': 0.02, 'overall_frequency': 1, 'body': {'sentiment': {'polarity': 'neutral', 'confidence': 0.84}, 'surface_forms': [{'text': 'Barchart.com, Inc', 'frequency': 1, 'mentions': [{'index': {'start': 1532, 'end': 1549}, 'sentiment': {'polarity': 'neutral', 'confidence': 0.84}}]}]}}, {'id': 'N230010966094220879952469184247200698535', 'types': ['Organization'], 'overall_sentiment': {'polarity': 'neutral', 'confidence': 0.74}, 'overall_prominence': 0.02, 'overall_frequency': 1, 'body': {'sentiment': {'polarity': 'neutral', 'confidence': 0.74}, 'surface_forms': [{'text': 'Disclaimer', 'frequency': 1, 'mentions': [{'index': {'start': 2047, 'end': 2057}, 'sentiment': {'polarity': 'neutral', 'confidence': 0.74}}]}]}}, {'id': 'N46017709575842147114358044171635234173', 'types': ['Organization'], 'overall_sentiment': {'polarity': 'neutral', 'confidence': 0.78}, 'overall_prominence': 0.02, 'overall_frequency': 1, 'body': {'sentiment': {'polarity': 'neutral', 'confidence': 0.78}, 'surface_forms': [{'text': 'Conditions', 'frequency': 1, 'mentions': [{'index': {'start': 2032, 'end': 2042}, 'sentiment': {'polarity': 'neutral', 'confidence': 0.78}}]}]}}, {'id': 'Q1345065', 'links': {'wikipedia': 'https://en.wikipedia.org/wiki/Federal_Deposit_Insurance_Corporation', 'wikidata': 'https://www.wikidata.org/wiki/Q1345065'}, 'types': ['Government_agency', 'Business', 'Organization'], 'overall_sentiment': {'polarity': 'neutral', 'confidence': 0.78}, 'overall_prominence': 0.02, 'overall_frequency': 1, 'body': {'sentiment': {'polarity': 'neutral', 'confidence': 0.78}, 'surface_forms': [{'text': 'FDIC', 'frequency': 1, 'mentions': [{'index': {'start': 1320, 'end': 1324}, 'sentiment': {'polarity': 'neutral', 'confidence': 0.78}}]}]}}, {'id': 'Q30', 'links': {'wikipedia': 'https://en.wikipedia.org/wiki/United_States', 'wikidata': 'https://www.wikidata.org/wiki/Q30'}, 'types': ['Organization', 'Location', 'State_(polity)', 'Sovereign_state', 'Country', 'Community'], 'overall_sentiment': {'polarity': 'neutral', 'confidence': 0.8}, 'overall_prominence': 0.02, 'overall_frequency': 1, 'body': {'sentiment': {'polarity': 'neutral', 'confidence': 0.8}, 'surface_forms': [{'text': 'U.S.', 'frequency': 1, 'mentions': [{'index': {'start': 1192, 'end': 1196}, 'sentiment': {'polarity': 'neutral', 'confidence': 0.8}}]}]}}, {'id': 'Q60', 'links': {'wikipedia': 'https://en.wikipedia.org/wiki/New_York_City', 'wikidata': 'https://www.wikidata.org/wiki/Q60'}, 'types': ['Organization', 'Political_organisation', 'Location', 'Government', 'Company', 'Corporation', 'Local_government', 'Community', 'City'], 'overall_sentiment': {'polarity': 'neutral', 'confidence': 0.83}, 'overall_prominence': 0.02, 'overall_frequency': 1, 'body': {'sentiment': {'polarity': 'neutral', 'confidence': 0.83}, 'surface_forms': [{'text': 'New York', 'frequency': 1, 'mentions': [{'index': {'start': 1202, 'end': 1210}, 'sentiment': {'polarity': 'neutral', 'confidence': 0.83}}]}]}}, {'id': 'Q2086913', 'links': {'wikipedia': 'https://en.wikipedia.org/wiki/Central_Time_Zone', 'wikidata': 'https://www.wikidata.org/wiki/Q2086913'}, 'types': ['Location', 'Product_(business)'], 'overall_sentiment': {'polarity': 'positive', 'confidence': 0.51}, 'overall_prominence': 0.02, 'overall_frequency': 1, 'body': {'sentiment': {'polarity': 'positive', 'confidence': 0.51}, 'surface_forms': [{'text': 'CT', 'frequency': 1, 'mentions': [{'index': {'start': 1078, 'end': 1080}, 'sentiment': {'polarity': 'positive', 'confidence': 0.51}}]}]}}, {'id': 'Q49169', 'links': {'wikipedia': 'https://en.wikipedia.org/wiki/Stamford,_Connecticut', 'wikidata': 'https://www.wikidata.org/wiki/Q49169'}, 'types': ['Organization', 'Political_organisation', 'Location', 'Government', 'Company', 'Corporation', 'Local_government', 'Community', 'City'], 'overall_sentiment': {'polarity': 'positive', 'confidence': 0.52}, 'overall_prominence': 0.02, 'overall_frequency': 1, 'body': {'sentiment': {'polarity': 'positive', 'confidence': 0.52}, 'surface_forms': [{'text': 'Stamford', 'frequency': 1, 'mentions': [{'index': {'start': 1068, 'end': 1076}, 'sentiment': {'polarity': 'positive', 'confidence': 0.52}}]}]}}, {'id': 'N170111476091942133039483067212272801859', 'types': ['Organization'], 'overall_sentiment': {'polarity': 'neutral', 'confidence': 0.82}, 'overall_prominence': 0.02, 'overall_frequency': 1, 'body': {'sentiment': {'polarity': 'neutral', 'confidence': 0.82}, 'surface_forms': [{'text': 'Barchart Market Data Solutions', 'frequency': 1, 'mentions': [{'index': {'start': 1592, 'end': 1622}, 'sentiment': {'polarity': 'neutral', 'confidence': 0.82}}]}]}}, {'id': 'N146394362897494094762808252755355902050', 'types': ['Human'], 'overall_sentiment': {'polarity': 'neutral', 'confidence': 0.89}, 'overall_prominence': 0.02, 'overall_frequency': 1, 'body': {'sentiment': {'polarity': 'neutral', 'confidence': 0.89}, 'surface_forms': [{'text': 'Edgar Online', 'frequency': 1, 'mentions': [{'index': {'start': 1728, 'end': 1740}, 'sentiment': {'polarity': 'neutral', 'confidence': 0.89}}]}]}}, {'id': 'N40369572299817662566574228466162607548', 'types': ['Organization'], 'overall_sentiment': {'polarity': 'positive', 'confidence': 0.79}, 'overall_prominence': 0.02, 'overall_frequency': 1, 'body': {'sentiment': {'polarity': 'positive', 'confidence': 0.79}, 'surface_forms': [{'text': 'Consumer Banking and Healthcare Financial Services', 'frequency': 1, 'mentions': [{'index': {'start': 870, 'end': 920}, 'sentiment': {'polarity': 'positive', 'confidence': 0.79}}]}]}}, {'id': 'Q24460', 'links': {'wikipedia': 'https://en.wikipedia.org/wiki/Northeastern_United_States', 'wikidata': 'https://www.wikidata.org/wiki/Q24460'}, 'types': ['Location'], 'overall_sentiment': {'polarity': 'positive', 'confidence': 0.79}, 'overall_prominence': 0.02, 'overall_frequency': 1, 'body': {'sentiment': {'polarity': 'positive', 'confidence': 0.79}, 'surface_forms': [{'text': 'Northeast', 'frequency': 1, 'mentions': [{'index': {'start': 719, 'end': 728}, 'sentiment': {'polarity': 'positive', 'confidence': 0.79}}]}]}}, {'id': 'Q771', 'links': {'wikipedia': 'https://en.wikipedia.org/wiki/Massachusetts', 'wikidata': 'https://www.wikidata.org/wiki/Q771'}, 'types': ['Organization', 'Location', 'State_(polity)', 'Community', 'U.S._state'], 'overall_sentiment': {'polarity': 'neutral', 'confidence': 0.81}, 'overall_prominence': 0.02, 'overall_frequency': 1, 'body': {'sentiment': {'polarity': 'neutral', 'confidence': 0.81}, 'surface_forms': [{'text': 'Massachusetts', 'frequency': 1, 'mentions': [{'index': {'start': 1214, 'end': 1227}, 'sentiment': {'polarity': 'neutral', 'confidence': 0.81}}]}]}}]","['#StamfordConnecticut', '#SoutheasternConference', '#SEC', '#NewYorkStockExchange', '#NewYork', '#NYSE', '#Massachusetts', '#ListOfQIEpisodes', '#HoldingCompany', '#HealthInsurance', '#FederalDepositInsuranceCorporation', '#FDIC', '#EmployeeBenefits', '#Dividend', '#DigitalTerrestrialTelevision', '#CommonStock', '#CommonLand', '#CommercialBank']",6729494277,"['digital', 'Stamford', 'NYSE', 'solutions', 'N.A', 'SEC', 'CT', 'Common', 'Barchart', 'company', 'Commercial Banking', 'Edgar Online', 'commercial bank', 'informational', 'holding company', 'New York', 'Northeast', 'Stamford, CT', 'Disclaimer', 'data', 'medical insurance', 'U.S', 'Barchart.com, Inc', 'Massachusetts', 'Webster', 'Conditions', 'dividend', 'Webster Bank', 'FDIC', 'Financial', 'U.S.', 'Bank', 'Series G', 'common stock']",en,"{'permalink': 'http://sogotradedev.websol.barchart.com/?module=topNews&storyID=25714569', 'clusters': '/stories?clusters[]=580344569'}",7,2024-04-24T20:44:17Z,16,"{'body': {'polarity': 'positive', 'score': 0.74}, 'title': {'polarity': 'neutral', 'score': 0.73}}","{'domain': 'sogotradedev.websol.barchart.com', 'home_page_url': 'https://www.sogotradedev.websol.barchart.com/', 'id': 137679, 'locations': [{'country': 'US'}], 'name': 'sogotradedev.websol.barchart.com'}","{'sentences': ['Webster Financial Corporation (NYSE:WBS), the holding company for Webster Bank, N.A., announced that its Board of Directors declared a quarterly cash dividend of $0.40 per share on its common stock.\n ', ""About Webster\n  Webster Financial Corporation (NYSE:WBS) is the holding company for Webster Bank, N.A. Webster is a leading commercial bank in the Northeast that provides a wide range of digital and traditional financial solutions across three differentiated lines of business: Commercial Banking, Consumer Banking and Healthcare Financial Services, one of the country's largest providers of employee benefits and administration of medical insurance claim settlements solutions."", 'On its Series G Preferred Stock, Webster declared a quarterly cash dividend of $16.25 per share ($0.40625 per each depositary share, 40 of which represents one share of Series G Preferred Stock), payable July 15, 2024, to shareholders of record on June 30, 2024.\n  ', 'The dividend on common shares will be payable May 16, 2024, to shareholders of record as of May 6, 2024.\n  ', 'Webster Bank is a member of the FDIC and an equal housing lender.']}",Webster Financial Corporation Declares Common and Preferred Dividends,324,0,
