author,body,categories,industries,characters_count,clusters,entities,hashtags,id,keywords,language,links,paragraphs_count,published_at,sentences_count,sentiment,source,summary,title,words_count,license_type,media
{'id': 1002187226},"Webster Financial Corporation (NYSE:WBS, Financial), the holding company for Webster Bank, N.A., announced that its Board of Directors declared a quarterly cash dividend of $0.40 per share on its common stock.

The dividend on common shares will be payable May 16, 2024, to shareholders of record as of May 6, 2024.

On its Series F Preferred Stock, Webster declared a quarterly cash dividend of $328.125 per share ($0.328125 per each depositary share, 1,000 of which represent one share of Series F Preferred Stock), payable June 15, 2024, to shareholders of record on June 1, 2024.

On its Series G Preferred Stock, Webster declared a quarterly cash dividend of $16.25 per share ($0.40625 per each depositary share, 40 of which represents one share of Series G Preferred Stock), payable July 15, 2024, to shareholders of record on June 30, 2024.

About Webster

Webster Financial Corporation (NYSE:WBS, Financial) is the holding company for Webster Bank, N.A. Webster is a leading commercial bank in the Northeast that provides a wide range of digital and traditional financial solutions across three differentiated lines of business: Commercial Banking, Consumer Banking and Healthcare Financial Services, one of the country's largest providers of employee benefits and administration of medical insurance claim settlements solutions. Headquartered in Stamford, CT, Webster is a values-driven organization with $76 billion in assets. Its core footprint spans the northeastern U.S. from New York to Massachusetts, with certain businesses operating in extended geographies. Webster Bank is a member of the FDIC and an equal housing lender. For more information about Webster, including past press releases and the latest annual report, visit the Webster website at www.websterbank.com.

View source version on businesswire.com: https://www.businesswire.com/news/home/20240424223843/en/","[{'id': 'IAB13', 'label': 'Personal Finance', 'score': 0.28, 'links': {'self': 'https://api.aylien.com/api/v1/classify/taxonomy/iab-qag/IAB13'}}, {'id': 'IAB13-11', 'label': 'Stocks', 'score': 0.13, 'links': {'parents': ['https://api.aylien.com/api/v1/classify/taxonomy/iab-qag/IAB13'], 'self': 'https://api.aylien.com/api/v1/classify/taxonomy/iab-qag/IAB13-11'}}, {'id': '04000000', 'label': 'economy, business and finance', 'score': 0.05, 'links': {'self': 'https://api.aylien.com/api/v1/classify/taxonomy/iptc-subjectcode/04000000'}}, {'id': '04006000', 'label': 'financial and business service', 'score': 0.05, 'links': {'parents': ['https://api.aylien.com/api/v1/classify/taxonomy/iptc-subjectcode/04000000'], 'self': 'https://api.aylien.com/api/v1/classify/taxonomy/iptc-subjectcode/04006000'}}, {'id': 'ay.biz.dividend', 'label': 'Dividends', 'score': 1, 'links': {'parents': ['https://api.aylien.com/api/v1/classify/taxonomy/aylien/ay.fin.biz', 'https://api.aylien.com/api/v1/classify/taxonomy/aylien/ay.impact'], 'self': 'https://api.aylien.com/api/v1/classify/taxonomy/aylien/ay.biz.dividend'}}, {'id': 'ay.fin', 'label': 'Finance', 'score': 1, 'links': {'self': 'https://api.aylien.com/api/v1/classify/taxonomy/aylien/ay.fin'}}, {'id': 'ay.fin.biz', 'label': 'Business Finance and Financing', 'score': 1, 'links': {'parents': ['https://api.aylien.com/api/v1/classify/taxonomy/aylien/ay.fin'], 'self': 'https://api.aylien.com/api/v1/classify/taxonomy/aylien/ay.fin.biz'}}, {'id': 'ay.fin.invest', 'label': 'Investments', 'score': 1, 'links': {'parents': ['https://api.aylien.com/api/v1/classify/taxonomy/aylien/ay.fin'], 'self': 'https://api.aylien.com/api/v1/classify/taxonomy/aylien/ay.fin.invest'}}, {'id': 'ay.fin.prstock', 'label': 'Preferred Stock', 'score': 1, 'links': {'parents': ['https://api.aylien.com/api/v1/classify/taxonomy/aylien/ay.fin.stocks'], 'self': 'https://api.aylien.com/api/v1/classify/taxonomy/aylien/ay.fin.prstock'}}, {'id': 'ay.fin.stocks', 'label': 'Stocks', 'score': 1, 'links': {'parents': ['https://api.aylien.com/api/v1/classify/taxonomy/aylien/ay.fin.invest'], 'self': 'https://api.aylien.com/api/v1/classify/taxonomy/aylien/ay.fin.stocks'}}, {'id': 'ay.impact', 'label': 'Trading Impact (ICE Codes) Important Corporate Events', 'score': 1, 'links': {'self': 'https://api.aylien.com/api/v1/classify/taxonomy/aylien/ay.impact'}}, {'id': 'ay.fin.comstock', 'label': 'Common Stock', 'score': 0.9, 'links': {'parents': ['https://api.aylien.com/api/v1/classify/taxonomy/aylien/ay.fin.stocks'], 'self': 'https://api.aylien.com/api/v1/classify/taxonomy/aylien/ay.fin.comstock'}}, {'id': 'ay.fin.sharehld', 'label': 'Corporate Shareholders', 'score': 0.9, 'links': {'parents': ['https://api.aylien.com/api/v1/classify/taxonomy/aylien/ay.fin.biz', 'https://api.aylien.com/api/v1/classify/taxonomy/aylien/ay.impact'], 'self': 'https://api.aylien.com/api/v1/classify/taxonomy/aylien/ay.fin.sharehld'}}, {'id': 'ay.biz', 'label': 'Business and Commerce', 'score': 0.8, 'links': {'self': 'https://api.aylien.com/api/v1/classify/taxonomy/aylien/ay.biz'}}]","[{'id': 'in.finserv', 'label': 'Financial Services and Banking', 'score': 1, 'links': {'self': 'https://api.aylien.com/api/v1/classify/taxonomy/industries/in.finserv'}}, {'id': 'in.finserv.banking', 'label': 'Banks and Banking', 'score': 1, 'links': {'parents': ['https://api.aylien.com/api/v1/classify/taxonomy/industries/in.finserv.lending'], 'self': 'https://api.aylien.com/api/v1/classify/taxonomy/industries/in.finserv.banking'}}, {'id': 'in.finserv.lending', 'label': 'Lending', 'score': 1, 'links': {'parents': ['https://api.aylien.com/api/v1/classify/taxonomy/industries/in.finserv'], 'self': 'https://api.aylien.com/api/v1/classify/taxonomy/industries/in.finserv.lending'}}]",1874,[580344569],"[{'id': 'N82926702310560770160669329693378460396', 'types': ['Organization'], 'overall_sentiment': {'polarity': 'neutral', 'confidence': 0.82}, 'overall_prominence': 0.98, 'overall_frequency': 1, 'title': {'sentiment': {'polarity': 'neutral', 'confidence': 0.82}, 'surface_forms': [{'text': 'Webster Financial Corporation Declares Common', 'frequency': 1, 'mentions': [{'index': {'start': 0, 'end': 45}, 'sentiment': {'polarity': 'neutral', 'confidence': 0.82}}]}]}}, {'id': 'N91425136111319926537141868413893791381', 'types': ['Location'], 'overall_sentiment': {'polarity': 'neutral', 'confidence': 0.89}, 'overall_prominence': 0.98, 'overall_frequency': 2, 'body': {'sentiment': {'polarity': 'neutral', 'confidence': 0.89}, 'surface_forms': [{'text': 'N.A', 'frequency': 2, 'mentions': [{'index': {'start': 91, 'end': 94}, 'sentiment': {'polarity': 'neutral', 'confidence': 0.86}}, {'index': {'start': 957, 'end': 960}, 'sentiment': {'polarity': 'neutral', 'confidence': 0.92}}]}]}}, {'id': 'N21852193859667912736195118793248820932', 'types': ['Organization'], 'overall_sentiment': {'polarity': 'neutral', 'confidence': 0.89}, 'overall_prominence': 0.98, 'overall_frequency': 2, 'body': {'sentiment': {'polarity': 'neutral', 'confidence': 0.89}, 'surface_forms': [{'text': 'Webster Financial Corporation', 'frequency': 2, 'mentions': [{'index': {'start': 0, 'end': 29}, 'sentiment': {'polarity': 'neutral', 'confidence': 0.86}}, {'index': {'start': 864, 'end': 893}, 'sentiment': {'polarity': 'neutral', 'confidence': 0.93}}]}]}}, {'id': 'Q7978891', 'links': {'wikipedia': 'https://en.wikipedia.org/wiki/Webster_Bank', 'wikidata': 'https://www.wikidata.org/wiki/Q7978891'}, 'stock_tickers': ['WBS'], 'types': ['Business', 'Organization'], 'overall_sentiment': {'polarity': 'neutral', 'confidence': 0.88}, 'overall_prominence': 0.98, 'overall_frequency': 2, 'body': {'sentiment': {'polarity': 'neutral', 'confidence': 0.88}, 'surface_forms': [{'text': 'WBS', 'frequency': 2, 'mentions': [{'index': {'start': 36, 'end': 39}, 'sentiment': {'polarity': 'neutral', 'confidence': 0.84}}, {'index': {'start': 900, 'end': 903}, 'sentiment': {'polarity': 'neutral', 'confidence': 0.92}}]}]}}, {'id': 'Q13677', 'links': {'wikipedia': 'https://en.wikipedia.org/wiki/New_York_Stock_Exchange', 'wikidata': 'https://www.wikidata.org/wiki/Q13677'}, 'types': ['Stock_exchange', 'Organization'], 'overall_sentiment': {'polarity': 'neutral', 'confidence': 0.88}, 'overall_prominence': 0.98, 'overall_frequency': 2, 'body': {'sentiment': {'polarity': 'neutral', 'confidence': 0.88}, 'surface_forms': [{'text': 'NYSE', 'frequency': 2, 'mentions': [{'index': {'start': 31, 'end': 35}, 'sentiment': {'polarity': 'neutral', 'confidence': 0.85}}, {'index': {'start': 895, 'end': 899}, 'sentiment': {'polarity': 'neutral', 'confidence': 0.91}}]}]}}, {'id': 'Q837171', 'links': {'wikipedia': 'https://en.wikipedia.org/wiki/Financial_services', 'wikidata': 'https://www.wikidata.org/wiki/Q837171'}, 'overall_sentiment': {'polarity': 'neutral', 'confidence': 0.88}, 'overall_prominence': 0.98, 'overall_frequency': 2, 'body': {'sentiment': {'polarity': 'neutral', 'confidence': 0.88}, 'surface_forms': [{'text': 'Financial', 'frequency': 2, 'mentions': [{'index': {'start': 41, 'end': 50}, 'sentiment': {'polarity': 'neutral', 'confidence': 0.84}}, {'index': {'start': 905, 'end': 914}, 'sentiment': {'polarity': 'neutral', 'confidence': 0.92}}]}]}}, {'id': 'A6006778', 'types': ['Company', 'Organization'], 'overall_sentiment': {'polarity': 'neutral', 'confidence': 0.85}, 'overall_prominence': 0.98, 'overall_frequency': 3, 'body': {'sentiment': {'polarity': 'neutral', 'confidence': 0.85}, 'surface_forms': [{'text': 'Webster Bank', 'frequency': 3, 'mentions': [{'index': {'start': 77, 'end': 89}, 'sentiment': {'polarity': 'neutral', 'confidence': 0.86}}, {'index': {'start': 943, 'end': 955}, 'sentiment': {'polarity': 'neutral', 'confidence': 0.91}}, {'index': {'start': 1575, 'end': 1587}, 'sentiment': {'polarity': 'neutral', 'confidence': 0.79}}]}]}}, {'id': 'Q188628', 'links': {'wikipedia': 'https://en.wikipedia.org/wiki/Board_of_directors', 'wikidata': 'https://www.wikidata.org/wiki/Q188628'}, 'overall_sentiment': {'polarity': 'neutral', 'confidence': 0.87}, 'overall_prominence': 0.74, 'overall_frequency': 1, 'body': {'sentiment': {'polarity': 'neutral', 'confidence': 0.87}, 'surface_forms': [{'text': 'Board of Directors', 'frequency': 1, 'mentions': [{'index': {'start': 116, 'end': 134}, 'sentiment': {'polarity': 'neutral', 'confidence': 0.87}}]}]}}, {'id': 'N132455243382660815565357953036070282241', 'types': ['Organization'], 'overall_sentiment': {'polarity': 'neutral', 'confidence': 0.89}, 'overall_prominence': 0.73, 'overall_frequency': 2, 'body': {'sentiment': {'polarity': 'neutral', 'confidence': 0.89}, 'surface_forms': [{'text': 'F Preferred Stock', 'frequency': 2, 'mentions': [{'index': {'start': 331, 'end': 348}, 'sentiment': {'polarity': 'neutral', 'confidence': 0.89}}, {'index': {'start': 498, 'end': 515}, 'sentiment': {'polarity': 'neutral', 'confidence': 0.9}}]}]}}, {'id': 'Q5225233', 'links': {'wikipedia': 'https://en.wikipedia.org/wiki/Darren_Webster', 'wikidata': 'https://www.wikidata.org/wiki/Q5225233'}, 'types': ['Human'], 'overall_sentiment': {'polarity': 'neutral', 'confidence': 0.88}, 'overall_prominence': 0.7, 'overall_frequency': 7, 'body': {'sentiment': {'polarity': 'neutral', 'confidence': 0.88}, 'surface_forms': [{'text': 'Webster', 'frequency': 7, 'mentions': [{'index': {'start': 350, 'end': 357}, 'sentiment': {'polarity': 'neutral', 'confidence': 0.91}}, {'index': {'start': 618, 'end': 625}, 'sentiment': {'polarity': 'neutral', 'confidence': 0.91}}, {'index': {'start': 855, 'end': 862}, 'sentiment': {'polarity': 'neutral', 'confidence': 0.91}}, {'index': {'start': 962, 'end': 969}, 'sentiment': {'polarity': 'positive', 'confidence': 0.77}}, {'index': {'start': 1369, 'end': 1376}, 'sentiment': {'polarity': 'positive', 'confidence': 0.51}}, {'index': {'start': 1668, 'end': 1675}, 'sentiment': {'polarity': 'neutral', 'confidence': 0.83}}, {'index': {'start': 1747, 'end': 1754}, 'sentiment': {'polarity': 'neutral', 'confidence': 0.81}}]}]}}, {'id': 'N192484442290441775375564376555541037325', 'types': ['Organization'], 'overall_sentiment': {'polarity': 'neutral', 'confidence': 0.9}, 'overall_prominence': 0.35, 'overall_frequency': 2, 'body': {'sentiment': {'polarity': 'neutral', 'confidence': 0.9}, 'surface_forms': [{'text': 'G Preferred Stock', 'frequency': 2, 'mentions': [{'index': {'start': 599, 'end': 616}, 'sentiment': {'polarity': 'neutral', 'confidence': 0.9}}, {'index': {'start': 761, 'end': 778}, 'sentiment': {'polarity': 'neutral', 'confidence': 0.9}}]}]}}, {'id': 'Q60', 'links': {'wikipedia': 'https://en.wikipedia.org/wiki/New_York_City', 'wikidata': 'https://www.wikidata.org/wiki/Q60'}, 'types': ['Political_organisation', 'Location', 'Organization', 'Community', 'City', 'Local_government', 'Company', 'Government', 'Corporation'], 'overall_sentiment': {'polarity': 'neutral', 'confidence': 0.83}, 'overall_prominence': 0.02, 'overall_frequency': 1, 'body': {'sentiment': {'polarity': 'neutral', 'confidence': 0.83}, 'surface_forms': [{'text': 'New York', 'frequency': 1, 'mentions': [{'index': {'start': 1489, 'end': 1497}, 'sentiment': {'polarity': 'neutral', 'confidence': 0.83}}]}]}}, {'id': 'Q24460', 'links': {'wikipedia': 'https://en.wikipedia.org/wiki/Northeastern_United_States', 'wikidata': 'https://www.wikidata.org/wiki/Q24460'}, 'types': ['Location'], 'overall_sentiment': {'polarity': 'positive', 'confidence': 0.79}, 'overall_prominence': 0.02, 'overall_frequency': 1, 'body': {'sentiment': {'polarity': 'positive', 'confidence': 0.79}, 'surface_forms': [{'text': 'Northeast', 'frequency': 1, 'mentions': [{'index': {'start': 1006, 'end': 1015}, 'sentiment': {'polarity': 'positive', 'confidence': 0.79}}]}]}}, {'id': 'Q30', 'links': {'wikipedia': 'https://en.wikipedia.org/wiki/United_States', 'wikidata': 'https://www.wikidata.org/wiki/Q30'}, 'types': ['Location', 'State_(polity)', 'Organization', 'Sovereign_state', 'Community', 'Country'], 'overall_sentiment': {'polarity': 'neutral', 'confidence': 0.8}, 'overall_prominence': 0.02, 'overall_frequency': 1, 'body': {'sentiment': {'polarity': 'neutral', 'confidence': 0.8}, 'surface_forms': [{'text': 'U.S.', 'frequency': 1, 'mentions': [{'index': {'start': 1479, 'end': 1483}, 'sentiment': {'polarity': 'neutral', 'confidence': 0.8}}]}]}}, {'id': 'Q49169', 'links': {'wikipedia': 'https://en.wikipedia.org/wiki/Stamford,_Connecticut', 'wikidata': 'https://www.wikidata.org/wiki/Q49169'}, 'types': ['Political_organisation', 'Location', 'Organization', 'Community', 'City', 'Local_government', 'Company', 'Government', 'Corporation'], 'overall_sentiment': {'polarity': 'positive', 'confidence': 0.52}, 'overall_prominence': 0.02, 'overall_frequency': 1, 'body': {'sentiment': {'polarity': 'positive', 'confidence': 0.52}, 'surface_forms': [{'text': 'Stamford', 'frequency': 1, 'mentions': [{'index': {'start': 1355, 'end': 1363}, 'sentiment': {'polarity': 'positive', 'confidence': 0.52}}]}]}}, {'id': 'Q2086913', 'links': {'wikipedia': 'https://en.wikipedia.org/wiki/Central_Time_Zone', 'wikidata': 'https://www.wikidata.org/wiki/Q2086913'}, 'types': ['Location', 'Product_(business)'], 'overall_sentiment': {'polarity': 'positive', 'confidence': 0.51}, 'overall_prominence': 0.02, 'overall_frequency': 1, 'body': {'sentiment': {'polarity': 'positive', 'confidence': 0.51}, 'surface_forms': [{'text': 'CT', 'frequency': 1, 'mentions': [{'index': {'start': 1365, 'end': 1367}, 'sentiment': {'polarity': 'positive', 'confidence': 0.51}}]}]}}, {'id': 'Q1345065', 'links': {'wikipedia': 'https://en.wikipedia.org/wiki/Federal_Deposit_Insurance_Corporation', 'wikidata': 'https://www.wikidata.org/wiki/Q1345065'}, 'types': ['Government_agency', 'Business', 'Organization'], 'overall_sentiment': {'polarity': 'neutral', 'confidence': 0.78}, 'overall_prominence': 0.02, 'overall_frequency': 1, 'body': {'sentiment': {'polarity': 'neutral', 'confidence': 0.78}, 'surface_forms': [{'text': 'FDIC', 'frequency': 1, 'mentions': [{'index': {'start': 1607, 'end': 1611}, 'sentiment': {'polarity': 'neutral', 'confidence': 0.78}}]}]}}, {'id': 'Q771', 'links': {'wikipedia': 'https://en.wikipedia.org/wiki/Massachusetts', 'wikidata': 'https://www.wikidata.org/wiki/Q771'}, 'types': ['Location', 'State_(polity)', 'Organization', 'Community', 'U.S._state'], 'overall_sentiment': {'polarity': 'neutral', 'confidence': 0.81}, 'overall_prominence': 0.02, 'overall_frequency': 1, 'body': {'sentiment': {'polarity': 'neutral', 'confidence': 0.81}, 'surface_forms': [{'text': 'Massachusetts', 'frequency': 1, 'mentions': [{'index': {'start': 1501, 'end': 1514}, 'sentiment': {'polarity': 'neutral', 'confidence': 0.81}}]}]}}, {'id': 'N40369572299817662566574228466162607548', 'types': ['Organization'], 'overall_sentiment': {'polarity': 'positive', 'confidence': 0.79}, 'overall_prominence': 0.02, 'overall_frequency': 1, 'body': {'sentiment': {'polarity': 'positive', 'confidence': 0.79}, 'surface_forms': [{'text': 'Consumer Banking and Healthcare Financial Services', 'frequency': 1, 'mentions': [{'index': {'start': 1157, 'end': 1207}, 'sentiment': {'polarity': 'positive', 'confidence': 0.79}}]}]}}, {'id': 'N249225933987928815812879274809947927665', 'types': ['Organization'], 'overall_sentiment': {'polarity': 'positive', 'confidence': 0.76}, 'overall_prominence': 0.02, 'overall_frequency': 1, 'body': {'sentiment': {'polarity': 'positive', 'confidence': 0.76}, 'surface_forms': [{'text': 'Commercial Banking', 'frequency': 1, 'mentions': [{'index': {'start': 1137, 'end': 1155}, 'sentiment': {'polarity': 'positive', 'confidence': 0.76}}]}]}}]","['#StamfordConnecticut', '#NewYorkStockExchange', '#NewYork', '#NYSE', '#Massachusetts', '#ListOfQIEpisodes', '#HoldingCompany', '#HealthInsurance', '#FederalDepositInsuranceCorporation', '#FDIC', '#EmployeeBenefits', '#Dividend', '#DigitalTerrestrialTelevision', '#CommonStock', '#CommonLand', '#CommercialBank']",6729828088,"['common stock', 'solutions', 'Northeast', 'commercial bank', 'Webster Bank', 'medical insurance', 'northeastern', 'dividend', 'Series G', 'Commercial Banking', 'CT', 'Stamford', 'digital', 'Stamford, CT', 'U.S', 'York', 'benefits', 'FDIC', 'Bank', 'Common', 'NYSE', 'holding company', 'administration', 'New York', 'Massachusetts', 'U.S.', 'Financial', 'Webster', 'N.A']",en,"{'permalink': 'https://www.gurufocus.com/news/2417260/webster-financial-corporation-declares-common-and-preferred-dividends', 'clusters': '/stories?clusters[]=580344569'}",7,2024-04-24T23:19:11Z,8,"{'body': {'polarity': 'positive', 'score': 0.99}, 'title': {'polarity': 'neutral', 'score': 0.73}}","{'domain': 'gurufocus.com', 'home_page_url': 'https://www.gurufocus.com/', 'id': 4852, 'locations': [{'city': 'Plano', 'country': 'US', 'state': 'Texas'}], 'name': 'GuruFocus', 'rankings': {'alexa': [{'fetched_at': '2020-11-13T02:07:52.943727635Z', 'rank': 8261}, {'country': 'IN', 'fetched_at': '2020-11-13T02:07:52.943727635Z', 'rank': 19216}, {'country': 'KW', 'fetched_at': '2020-11-13T02:07:52.943727635Z', 'rank': 446}, {'country': 'SG', 'fetched_at': '2020-11-13T02:07:52.943727635Z', 'rank': 1694}, {'country': 'TR', 'fetched_at': '2020-11-13T02:07:52.943727635Z', 'rank': 23822}, {'country': 'MY', 'fetched_at': '2020-11-13T02:07:52.943727635Z', 'rank': 5553}, {'country': 'RU', 'fetched_at': '2020-11-13T02:07:52.943727635Z', 'rank': 4948}, {'country': 'IL', 'fetched_at': '2020-11-13T02:07:52.943727635Z', 'rank': 3556}, {'country': 'TW', 'fetched_at': '2020-11-13T02:07:52.943727635Z', 'rank': 2405}, {'country': 'PK', 'fetched_at': '2020-11-13T02:07:52.943727635Z', 'rank': 25686}, {'country': 'US', 'fetched_at': '2020-11-13T02:07:52.943727635Z', 'rank': 4191}, {'country': 'HK', 'fetched_at': '2020-11-13T02:07:52.943727635Z', 'rank': 5385}, {'country': 'AU', 'fetched_at': '2020-11-13T02:07:52.943727635Z', 'rank': 4333}, {'country': 'AE', 'fetched_at': '2020-11-13T02:07:52.943727635Z', 'rank': 8702}, {'country': 'AR', 'fetched_at': '2020-11-13T02:07:52.943727635Z', 'rank': 7682}, {'country': 'CO', 'fetched_at': '2020-11-13T02:07:52.943727635Z', 'rank': 3484}, {'country': 'UA', 'fetched_at': '2020-11-13T02:07:52.943727635Z', 'rank': 7185}, {'country': 'KE', 'fetched_at': '2020-11-13T02:07:52.943727635Z', 'rank': 952}, {'country': 'CA', 'fetched_at': '2020-11-13T02:07:52.943727635Z', 'rank': 2777}]}, 'scopes': [{'country': 'US'}]}","{'sentences': ['Webster Financial Corporation (NYSE:WBS, Financial), the holding company for Webster Bank, N.A., announced that its Board of Directors declared a quarterly cash dividend of $0.40 per share on its common stock.\n\n', 'On its Series G Preferred Stock, Webster declared a quarterly cash dividend of $16.25 per share ($0.40625 per each depositary share, 40 of which represents one share of Series G Preferred Stock), payable July 15, 2024, to shareholders of record on June 30, 2024.\n\n', 'On its Series F Preferred Stock, Webster declared a quarterly cash dividend of $328.125 per share ($0.328125 per each depositary share, 1,000 of which represent one share of Series F Preferred Stock), payable June 15, 2024, to shareholders of record on June 1, 2024.\n\n', ""About Webster\n\nWebster Financial Corporation (NYSE:WBS, Financial) is the holding company for Webster Bank, N.A. Webster is a leading commercial bank in the Northeast that provides a wide range of digital and traditional financial solutions across three differentiated lines of business: Commercial Banking, Consumer Banking and Healthcare Financial Services, one of the country's largest providers of employee benefits and administration of medical insurance claim settlements solutions."", 'The dividend on common shares will be payable May 16, 2024, to shareholders of record as of May 6, 2024.\n\n']}",Webster Financial Corporation Declares Common and Preferred Dividends,283,0,
