author,body,categories,industries,characters_count,clusters,entities,hashtags,id,keywords,language,links,paragraphs_count,published_at,sentences_count,sentiment,source,summary,title,words_count,license_type,media
{'id': 1066209000},"MENAFN - 3BL) CINCINNATI, April 24, 2024 /3BL/ - Fifth Third Bank's Kala Gibson, chief corporate responsibility officer, and Kevin P.
Lavender, head of commercial banking, have been named to Savoy Magazine's 2024 Most Influential Executives in Corporate America list. This special issue highlights a dynamic group of CEOs, COOs and top executives who exemplify exceptional leadership and influence in the corporate world.
  A member of the enterprise committee, Gibson oversees the Bank's corporate citizenship work, which includes Community Development Banking, Community Impact Banking, Community Reinvestment Act, Inclusion and Diversity and Sustainability. He also serves as chair of the Fifth Third Foundation's distribution committee, the Bank's Corporate Sustainability Committee and is a founding member of the Bank's Executive Diversity Leadership Council.
  He joined Fifth Third in 2011 as business banking executive for Eastern Michigan. He became the Bank's head of Business Banking in 2013, overseeing the division's strategic planning, operations, sales force, credit fulfillment and product development. In 2020, he led the bank's Paycheck Protection Program lending and in 2021 led the acquisition of Provide Inc. Gibson started his career at Comerica Bank in Detroit and has more than 30 years of experience in business banking and credit administration.
  As Head of Commercial Banking for Fifth Third, Lavender is responsible for overseeing the Bank's vertically integrated commercial sales teams, Corporate Banking, Commercial Real Estate, Capital Markets, Specialty Lending and Treasury Management businesses. He's also a member of the enterprise committee. He joined Fifth Third in 2005 as senior vice president and head of national corporate health care lending. In January 2009, he was named senior vice president and managing director of large corporate and specialized lending, a role in which he oversaw international and large corporate finance in addition to national health care finance.
  Before joining Fifth Third, he served as commissioner of the Tennessee Department of Financial Institutions. Before that, he was co-founder and executive vice president of MediSphere Health Partners Inc. He began his career as group vice president for health care lending with SunTrust Bank Inc.
  L.P. Green, II, the Publisher of Savoy Magazine, expressed his enthusiasm: ""As we celebrate our 23rd anniversary, it's an honor to spotlight such extraordinary individuals in our 2024 edition. These leaders are not just excelling in their fields; they're setting new benchmarks for excellence and inspiring future generations.""
  Print copies of the latest issue of Savoy Magazine are available for purchase at SavoyNetwork .
  About Savoy Magazine
  Savoy Magazine is a leading publication celebrating the African American lifestyle and culture. Covering a wide range of topics from business and politics to entertainment and style, Savoy serves as a critical platform for showcasing the richness of the Black experience. Distributed globally through subscriptions and newsstands, Savoy is a key influencer in driving meaningful discourse in the African American community.
  About Fifth Third
  Fifth Third is a bank that's as long on innovation as it is on history. Since 1858, we've been helping individuals, families, businesses and communities grow through smart financial services that improve lives. Our list of firsts is extensive, and it's one that continues to expand as we explore the intersection of tech-driven innovation, dedicated people and focused community impact. Fifth Third is one of the few U.S.-based banks to have been named among Ethisphere's World's Most Ethical Companies® for several years. With a commitment to taking care of our customers, employees, communities and shareholders, our goal is not only to be the nation's highest performing regional bank, but to be the bank people most value and trust.
  Fifth Third Bank, National Association is a federally chartered institution. Fifth Third Bancorp is the indirect parent company of Fifth Third Bank and its common stock is traded on the NASDAQ® Global Select Market under the symbol ""FITB."" Investor information and press releases can be viewed at . Deposit and credit products provided by Fifth Third Bank, National Association. Member FDIC.
  MENAFN24042024007202015466ID1108134194","[{'id': 'IAB13', 'label': 'Personal Finance', 'score': 0.17, 'links': {'self': 'https://api.aylien.com/api/v1/classify/taxonomy/iab-qag/IAB13'}}, {'id': 'IAB13-4', 'label': 'Financial Planning', 'score': 0.12, 'links': {'parents': ['https://api.aylien.com/api/v1/classify/taxonomy/iab-qag/IAB13'], 'self': 'https://api.aylien.com/api/v1/classify/taxonomy/iab-qag/IAB13-4'}}, {'id': 'IAB3', 'label': 'Business', 'score': 0.14, 'links': {'self': 'https://api.aylien.com/api/v1/classify/taxonomy/iab-qag/IAB3'}}, {'id': 'IAB3-9', 'label': 'Human Resources', 'score': 0.29, 'links': {'parents': ['https://api.aylien.com/api/v1/classify/taxonomy/iab-qag/IAB3'], 'self': 'https://api.aylien.com/api/v1/classify/taxonomy/iab-qag/IAB3-9'}}, {'id': '04000000', 'label': 'economy, business and finance', 'score': 0.09, 'links': {'self': 'https://api.aylien.com/api/v1/classify/taxonomy/iptc-subjectcode/04000000'}}, {'id': '04019000', 'label': 'finance (general)', 'score': 0.09, 'links': {'parents': ['https://api.aylien.com/api/v1/classify/taxonomy/iptc-subjectcode/04000000'], 'self': 'https://api.aylien.com/api/v1/classify/taxonomy/iptc-subjectcode/04019000'}}, {'id': 'ay.biz', 'label': 'Business and Commerce', 'score': 0.8, 'links': {'self': 'https://api.aylien.com/api/v1/classify/taxonomy/aylien/ay.biz'}}, {'id': 'ay.biz.corpresp', 'label': 'Corporate Responsibility', 'score': 0.8, 'links': {'parents': ['https://api.aylien.com/api/v1/classify/taxonomy/aylien/ay.biz.manage', 'https://api.aylien.com/api/v1/classify/taxonomy/aylien/ay.lifesoc.esg'], 'self': 'https://api.aylien.com/api/v1/classify/taxonomy/aylien/ay.biz.corpresp'}}, {'id': 'ay.biz.manage', 'label': 'Business Management', 'score': 0.8, 'links': {'parents': ['https://api.aylien.com/api/v1/classify/taxonomy/aylien/ay.biz'], 'self': 'https://api.aylien.com/api/v1/classify/taxonomy/aylien/ay.biz.manage'}}, {'id': 'ay.fin', 'label': 'Finance', 'score': 0.8, 'links': {'self': 'https://api.aylien.com/api/v1/classify/taxonomy/aylien/ay.fin'}}, {'id': 'ay.fin.banking', 'label': 'Banking', 'score': 0.8, 'links': {'parents': ['https://api.aylien.com/api/v1/classify/taxonomy/aylien/ay.fin'], 'self': 'https://api.aylien.com/api/v1/classify/taxonomy/aylien/ay.fin.banking'}}, {'id': 'ay.lifesoc', 'label': 'Life and Society', 'score': 0.8, 'links': {'self': 'https://api.aylien.com/api/v1/classify/taxonomy/aylien/ay.lifesoc'}}, {'id': 'ay.lifesoc.esg', 'label': 'Environmental, Social and Governance', 'score': 0.8, 'links': {'parents': ['https://api.aylien.com/api/v1/classify/taxonomy/aylien/ay.lifesoc'], 'self': 'https://api.aylien.com/api/v1/classify/taxonomy/aylien/ay.lifesoc.esg'}}, {'id': 'ay.culture', 'label': 'Culture, Entertainment and the Arts', 'score': 0.6, 'links': {'self': 'https://api.aylien.com/api/v1/classify/taxonomy/aylien/ay.culture'}}]","[{'id': 'in.finserv', 'label': 'Financial Services and Banking', 'score': 1, 'links': {'self': 'https://api.aylien.com/api/v1/classify/taxonomy/industries/in.finserv'}}, {'id': 'in.finserv.banking', 'label': 'Banks and Banking', 'score': 1, 'links': {'parents': ['https://api.aylien.com/api/v1/classify/taxonomy/industries/in.finserv.lending'], 'self': 'https://api.aylien.com/api/v1/classify/taxonomy/industries/in.finserv.banking'}}, {'id': 'in.finserv.lending', 'label': 'Lending', 'score': 1, 'links': {'parents': ['https://api.aylien.com/api/v1/classify/taxonomy/industries/in.finserv'], 'self': 'https://api.aylien.com/api/v1/classify/taxonomy/industries/in.finserv.lending'}}]",4374,[580339897],"[{'id': 'N193103270523059123109100808866209654631', 'types': ['Human'], 'overall_sentiment': {'polarity': 'positive', 'confidence': 0.64}, 'overall_prominence': 0.98, 'overall_frequency': 2, 'body': {'sentiment': {'polarity': 'neutral', 'confidence': 0.59}, 'surface_forms': [{'text': 'Kala Gibson', 'frequency': 1, 'mentions': [{'index': {'start': 68, 'end': 79}, 'sentiment': {'polarity': 'neutral', 'confidence': 0.59}}]}]}, 'title': {'sentiment': {'polarity': 'positive', 'confidence': 0.64}, 'surface_forms': [{'text': 'Kala Gibson', 'frequency': 1, 'mentions': [{'index': {'start': 14, 'end': 25}, 'sentiment': {'polarity': 'positive', 'confidence': 0.64}}]}]}}, {'id': 'N313759475035333205565752292699899924536', 'types': ['Organization'], 'overall_sentiment': {'polarity': 'neutral', 'confidence': 0.82}, 'overall_prominence': 0.98, 'overall_frequency': 8, 'body': {'sentiment': {'polarity': 'neutral', 'confidence': 0.82}, 'surface_forms': [{'text': 'Fifth Third', 'frequency': 7, 'mentions': [{'index': {'start': 878, 'end': 889}, 'sentiment': {'polarity': 'neutral', 'confidence': 0.93}}, {'index': {'start': 1409, 'end': 1420}, 'sentiment': {'polarity': 'neutral', 'confidence': 0.88}}, {'index': {'start': 1690, 'end': 1701}, 'sentiment': {'polarity': 'neutral', 'confidence': 0.92}}, {'index': {'start': 2036, 'end': 2047}, 'sentiment': {'polarity': 'neutral', 'confidence': 0.89}}, {'index': {'start': 3202, 'end': 3213}, 'sentiment': {'polarity': 'neutral', 'confidence': 0.61}}, {'index': {'start': 3216, 'end': 3227}, 'sentiment': {'polarity': 'neutral', 'confidence': 0.67}}, {'index': {'start': 3603, 'end': 3614}, 'sentiment': {'polarity': 'positive', 'confidence': 0.71}}]}]}, 'title': {'sentiment': {'polarity': 'positive', 'confidence': 0.7}, 'surface_forms': [{'text': 'Fifth Third', 'frequency': 1, 'mentions': [{'index': {'start': 0, 'end': 11}, 'sentiment': {'polarity': 'positive', 'confidence': 0.7}}]}]}}, {'id': 'N152919136847457298100539355141505902713', 'types': ['Organization'], 'overall_sentiment': {'polarity': 'neutral', 'confidence': 0.66}, 'overall_prominence': 0.98, 'overall_frequency': 2, 'body': {'sentiment': {'polarity': 'neutral', 'confidence': 0.66}, 'surface_forms': [{'text': 'MENAFN', 'frequency': 2, 'mentions': [{'index': {'start': 0, 'end': 6}, 'sentiment': {'polarity': 'neutral', 'confidence': 0.54}}, {'index': {'start': 4349, 'end': 4355}, 'sentiment': {'polarity': 'neutral', 'confidence': 0.78}}]}]}}, {'id': 'Q1411810', 'links': {'wikipedia': 'https://en.wikipedia.org/wiki/Fifth_Third_Bank', 'wikidata': 'https://www.wikidata.org/wiki/Q1411810'}, 'stock_tickers': ['FITB'], 'types': ['Financial_institution', 'Bank', 'Business', 'Organization'], 'overall_sentiment': {'polarity': 'neutral', 'confidence': 0.84}, 'overall_prominence': 0.98, 'overall_frequency': 5, 'body': {'sentiment': {'polarity': 'neutral', 'confidence': 0.84}, 'surface_forms': [{'text': 'Fifth Third Bank', 'frequency': 4, 'mentions': [{'index': {'start': 49, 'end': 65}, 'sentiment': {'polarity': 'neutral', 'confidence': 0.58}}, {'index': {'start': 3955, 'end': 3971}, 'sentiment': {'polarity': 'neutral', 'confidence': 0.87}}, {'index': {'start': 4086, 'end': 4102}, 'sentiment': {'polarity': 'neutral', 'confidence': 0.93}}, {'index': {'start': 4294, 'end': 4310}, 'sentiment': {'polarity': 'neutral', 'confidence': 0.88}}]}, {'text': 'Fifth Third Bancorp', 'frequency': 1, 'mentions': [{'index': {'start': 4032, 'end': 4051}, 'sentiment': {'polarity': 'neutral', 'confidence': 0.94}}]}]}}, {'id': 'N218634830022768050701455522595510986137', 'types': ['Human'], 'overall_sentiment': {'polarity': 'positive', 'confidence': 0.63}, 'overall_prominence': 0.96, 'overall_frequency': 1, 'title': {'sentiment': {'polarity': 'positive', 'confidence': 0.63}, 'surface_forms': [{'text': 'Kevin Lavender', 'frequency': 1, 'mentions': [{'index': {'start': 27, 'end': 41}, 'sentiment': {'polarity': 'positive', 'confidence': 0.63}}]}]}}, {'id': 'N158854278561028932476717788079281920329', 'types': ['Location'], 'overall_sentiment': {'polarity': 'neutral', 'confidence': 0.59}, 'overall_prominence': 0.94, 'overall_frequency': 1, 'title': {'sentiment': {'polarity': 'neutral', 'confidence': 0.59}, 'surface_forms': [{'text': 'Recognized', 'frequency': 1, 'mentions': [{'index': {'start': 42, 'end': 52}, 'sentiment': {'polarity': 'neutral', 'confidence': 0.59}}]}]}}, {'id': 'N27330582573941158374486373923057695851', 'types': ['Location'], 'overall_sentiment': {'polarity': 'positive', 'confidence': 0.63}, 'overall_prominence': 0.87, 'overall_frequency': 1, 'title': {'sentiment': {'polarity': 'positive', 'confidence': 0.63}, 'surface_forms': [{'text': 'Corporate America', 'frequency': 1, 'mentions': [{'index': {'start': 92, 'end': 109}, 'sentiment': {'polarity': 'positive', 'confidence': 0.63}}]}]}}, {'id': 'N179499452590560538573615527827653041126', 'types': ['Organization'], 'overall_sentiment': {'polarity': 'neutral', 'confidence': 0.76}, 'overall_prominence': 0.87, 'overall_frequency': 4, 'body': {'sentiment': {'polarity': 'neutral', 'confidence': 0.76}, 'surface_forms': [{'text': 'Savoy Magazine', 'frequency': 4, 'mentions': [{'index': {'start': 191, 'end': 205}, 'sentiment': {'polarity': 'neutral', 'confidence': 0.69}}, {'index': {'start': 2685, 'end': 2699}, 'sentiment': {'polarity': 'neutral', 'confidence': 0.84}}, {'index': {'start': 2753, 'end': 2767}, 'sentiment': {'polarity': 'positive', 'confidence': 0.68}}, {'index': {'start': 2770, 'end': 2784}, 'sentiment': {'polarity': 'positive', 'confidence': 0.66}}]}]}}, {'id': 'N58815476768425115925213776024753749008', 'types': ['Human'], 'overall_sentiment': {'polarity': 'neutral', 'confidence': 0.55}, 'overall_prominence': 0.82, 'overall_frequency': 1, 'body': {'sentiment': {'polarity': 'neutral', 'confidence': 0.55}, 'surface_forms': [{'text': 'CINCINNATI', 'frequency': 1, 'mentions': [{'index': {'start': 14, 'end': 24}, 'sentiment': {'polarity': 'neutral', 'confidence': 0.55}}]}]}}, {'id': 'N72640639171495442858669162653798071504', 'types': ['Human'], 'overall_sentiment': {'polarity': 'neutral', 'confidence': 0.56}, 'overall_prominence': 0.67, 'overall_frequency': 1, 'body': {'sentiment': {'polarity': 'neutral', 'confidence': 0.56}, 'surface_forms': [{'text': 'Kevin P.\nLavender', 'frequency': 1, 'mentions': [{'index': {'start': 125, 'end': 142}, 'sentiment': {'polarity': 'neutral', 'confidence': 0.56}}]}]}}, {'id': 'N177467119005416535069084178489218759944', 'types': ['Organization'], 'overall_sentiment': {'polarity': 'neutral', 'confidence': 0.84}, 'overall_prominence': 0.53, 'overall_frequency': 1, 'body': {'sentiment': {'polarity': 'neutral', 'confidence': 0.84}, 'surface_forms': [{'text': 'Influential Executives', 'frequency': 1, 'mentions': [{'index': {'start': 218, 'end': 240}, 'sentiment': {'polarity': 'neutral', 'confidence': 0.84}}]}]}}, {'id': 'Q30', 'links': {'wikipedia': 'https://en.wikipedia.org/wiki/United_States', 'wikidata': 'https://www.wikidata.org/wiki/Q30'}, 'types': ['Country', 'Organization', 'State_(polity)', 'Sovereign_state', 'Community', 'Location'], 'overall_sentiment': {'polarity': 'neutral', 'confidence': 0.6}, 'overall_prominence': 0.48, 'overall_frequency': 1, 'body': {'sentiment': {'polarity': 'neutral', 'confidence': 0.6}, 'surface_forms': [{'text': 'America', 'frequency': 1, 'mentions': [{'index': {'start': 254, 'end': 261}, 'sentiment': {'polarity': 'neutral', 'confidence': 0.6}}]}]}}, {'id': 'Q22687', 'links': {'wikipedia': 'https://en.wikipedia.org/wiki/Bank', 'wikidata': 'https://www.wikidata.org/wiki/Q22687'}, 'overall_sentiment': {'polarity': 'neutral', 'confidence': 0.87}, 'overall_prominence': 0.46, 'overall_frequency': 5, 'body': {'sentiment': {'polarity': 'neutral', 'confidence': 0.87}, 'surface_forms': [{'text': 'Bank', 'frequency': 5, 'mentions': [{'index': {'start': 482, 'end': 486}, 'sentiment': {'polarity': 'neutral', 'confidence': 0.71}}, {'index': {'start': 745, 'end': 749}, 'sentiment': {'polarity': 'neutral', 'confidence': 0.91}}, {'index': {'start': 819, 'end': 823}, 'sentiment': {'polarity': 'neutral', 'confidence': 0.92}}, {'index': {'start': 964, 'end': 968}, 'sentiment': {'polarity': 'neutral', 'confidence': 0.91}}, {'index': {'start': 1465, 'end': 1469}, 'sentiment': {'polarity': 'neutral', 'confidence': 0.91}}]}]}}, {'id': 'Q1966945', 'links': {'wikipedia': 'https://en.wikipedia.org/wiki/National_Association_of_Professional_Base_Ball_Players', 'wikidata': 'https://www.wikidata.org/wiki/Q1966945'}, 'types': ['Organization'], 'overall_sentiment': {'polarity': 'neutral', 'confidence': 0.91}, 'overall_prominence': 0.31, 'overall_frequency': 2, 'body': {'sentiment': {'polarity': 'neutral', 'confidence': 0.91}, 'surface_forms': [{'text': 'National Association', 'frequency': 2, 'mentions': [{'index': {'start': 3973, 'end': 3993}, 'sentiment': {'polarity': 'neutral', 'confidence': 0.92}}, {'index': {'start': 4312, 'end': 4332}, 'sentiment': {'polarity': 'neutral', 'confidence': 0.91}}]}]}}, {'id': 'Q14118', 'links': {'wikipedia': 'https://en.wikipedia.org/wiki/Savoy', 'wikidata': 'https://www.wikidata.org/wiki/Q14118'}, 'types': ['Location'], 'overall_sentiment': {'polarity': 'positive', 'confidence': 0.68}, 'overall_prominence': 0.31, 'overall_frequency': 2, 'body': {'sentiment': {'polarity': 'positive', 'confidence': 0.68}, 'surface_forms': [{'text': 'Savoy', 'frequency': 2, 'mentions': [{'index': {'start': 2953, 'end': 2958}, 'sentiment': {'polarity': 'positive', 'confidence': 0.8}}, {'index': {'start': 3101, 'end': 3106}, 'sentiment': {'polarity': 'positive', 'confidence': 0.56}}]}]}}, {'id': 'Q2035701', 'links': {'wikipedia': 'https://en.wikipedia.org/wiki/Race_and_ethnicity_in_the_United_States_Census', 'wikidata': 'https://www.wikidata.org/wiki/Q2035701'}, 'overall_sentiment': {'polarity': 'positive', 'confidence': 0.82}, 'overall_prominence': 0.31, 'overall_frequency': 2, 'body': {'sentiment': {'polarity': 'positive', 'confidence': 0.82}, 'surface_forms': [{'text': 'African American', 'frequency': 2, 'mentions': [{'index': {'start': 2826, 'end': 2842}, 'sentiment': {'polarity': 'positive', 'confidence': 0.83}}, {'index': {'start': 3166, 'end': 3182}, 'sentiment': {'polarity': 'positive', 'confidence': 0.81}}]}]}}, {'id': 'Q246097', 'links': {'wikipedia': 'https://en.wikipedia.org/wiki/Gibson_Technology', 'wikidata': 'https://www.wikidata.org/wiki/Q246097'}, 'types': ['Business', 'Organization'], 'overall_sentiment': {'polarity': 'neutral', 'confidence': 0.74}, 'overall_prominence': 0.18, 'overall_frequency': 1, 'body': {'sentiment': {'polarity': 'neutral', 'confidence': 0.74}, 'surface_forms': [{'text': 'Gibson', 'frequency': 1, 'mentions': [{'index': {'start': 462, 'end': 468}, 'sentiment': {'polarity': 'neutral', 'confidence': 0.74}}]}]}}, {'id': 'N8325272491354671035405497478762913661', 'types': ['Organization'], 'overall_sentiment': {'polarity': 'neutral', 'confidence': 0.69}, 'overall_prominence': 0.08, 'overall_frequency': 1, 'body': {'sentiment': {'polarity': 'neutral', 'confidence': 0.69}, 'surface_forms': [{'text': 'Community Development Banking', 'frequency': 1, 'mentions': [{'index': {'start': 532, 'end': 561}, 'sentiment': {'polarity': 'neutral', 'confidence': 0.69}}]}]}}, {'id': 'N326288999793659632736946033234207489872', 'types': ['Organization'], 'overall_sentiment': {'polarity': 'neutral', 'confidence': 0.69}, 'overall_prominence': 0.04, 'overall_frequency': 1, 'body': {'sentiment': {'polarity': 'neutral', 'confidence': 0.69}, 'surface_forms': [{'text': 'Community Impact Banking', 'frequency': 1, 'mentions': [{'index': {'start': 563, 'end': 587}, 'sentiment': {'polarity': 'neutral', 'confidence': 0.69}}]}]}}, {'id': 'N90161524353238029740809294444364023454', 'types': ['Organization'], 'overall_sentiment': {'polarity': 'neutral', 'confidence': 0.89}, 'overall_prominence': 0.02, 'overall_frequency': 1, 'body': {'sentiment': {'polarity': 'neutral', 'confidence': 0.89}, 'surface_forms': [{'text': 'Tennessee Department of Financial Institutions', 'frequency': 1, 'mentions': [{'index': {'start': 2082, 'end': 2128}, 'sentiment': {'polarity': 'neutral', 'confidence': 0.89}}]}]}}, {'id': 'N136640867258905692469961766201062539111', 'types': ['Organization'], 'overall_sentiment': {'polarity': 'positive', 'confidence': 0.98}, 'overall_prominence': 0.02, 'overall_frequency': 1, 'body': {'sentiment': {'polarity': 'positive', 'confidence': 0.98}, 'surface_forms': [{'text': 'II', 'frequency': 1, 'mentions': [{'index': {'start': 2331, 'end': 2333}, 'sentiment': {'polarity': 'positive', 'confidence': 0.98}}]}]}}, {'id': 'Q94184165', 'links': {'wikipedia': 'https://en.wikipedia.org/wiki/Paycheck_Protection_Program', 'wikidata': 'https://www.wikidata.org/wiki/Q94184165'}, 'types': ['Government_agency', 'Organization'], 'overall_sentiment': {'polarity': 'neutral', 'confidence': 0.74}, 'overall_prominence': 0.02, 'overall_frequency': 1, 'body': {'sentiment': {'polarity': 'neutral', 'confidence': 0.74}, 'surface_forms': [{'text': 'Paycheck Protection Program', 'frequency': 1, 'mentions': [{'index': {'start': 1147, 'end': 1174}, 'sentiment': {'polarity': 'neutral', 'confidence': 0.74}}]}]}}, {'id': 'Q750458', 'links': {'wikipedia': 'https://en.wikipedia.org/wiki/Capital_market', 'wikidata': 'https://www.wikidata.org/wiki/Q750458'}, 'overall_sentiment': {'polarity': 'neutral', 'confidence': 0.89}, 'overall_prominence': 0.02, 'overall_frequency': 1, 'body': {'sentiment': {'polarity': 'neutral', 'confidence': 0.89}, 'surface_forms': [{'text': 'Capital Markets', 'frequency': 1, 'mentions': [{'index': {'start': 1561, 'end': 1576}, 'sentiment': {'polarity': 'neutral', 'confidence': 0.89}}]}]}}, {'id': 'N228483813626506439087203932590203357239', 'types': ['Organization'], 'overall_sentiment': {'polarity': 'neutral', 'confidence': 0.91}, 'overall_prominence': 0.02, 'overall_frequency': 1, 'body': {'sentiment': {'polarity': 'neutral', 'confidence': 0.91}, 'surface_forms': [{'text': 'Corporate Sustainability Committee', 'frequency': 1, 'mentions': [{'index': {'start': 752, 'end': 786}, 'sentiment': {'polarity': 'neutral', 'confidence': 0.91}}]}]}}, {'id': 'N303899490035194591385988855086078677002', 'types': ['Organization'], 'overall_sentiment': {'polarity': 'neutral', 'confidence': 0.83}, 'overall_prominence': 0.02, 'overall_frequency': 1, 'body': {'sentiment': {'polarity': 'neutral', 'confidence': 0.83}, 'surface_forms': [{'text': 'SavoyNetwork', 'frequency': 1, 'mentions': [{'index': {'start': 2730, 'end': 2742}, 'sentiment': {'polarity': 'neutral', 'confidence': 0.83}}]}]}}, {'id': 'N323608571158763460240729229152031883117', 'types': ['Human'], 'overall_sentiment': {'polarity': 'positive', 'confidence': 0.98}, 'overall_prominence': 0.02, 'overall_frequency': 1, 'body': {'sentiment': {'polarity': 'positive', 'confidence': 0.98}, 'surface_forms': [{'text': 'L.P. Green', 'frequency': 1, 'mentions': [{'index': {'start': 2319, 'end': 2329}, 'sentiment': {'polarity': 'positive', 'confidence': 0.98}}]}]}}, {'id': 'N196145494981364514029737241318790677787', 'types': ['Organization'], 'overall_sentiment': {'polarity': 'neutral', 'confidence': 0.92}, 'overall_prominence': 0.02, 'overall_frequency': 1, 'body': {'sentiment': {'polarity': 'neutral', 'confidence': 0.92}, 'surface_forms': [{'text': 'Executive Diversity Leadership Council', 'frequency': 1, 'mentions': [{'index': {'start': 826, 'end': 864}, 'sentiment': {'polarity': 'neutral', 'confidence': 0.92}}]}]}}, {'id': 'Q1345065', 'links': {'wikipedia': 'https://en.wikipedia.org/wiki/Federal_Deposit_Insurance_Corporation', 'wikidata': 'https://www.wikidata.org/wiki/Q1345065'}, 'types': ['Government_agency', 'Business', 'Organization'], 'overall_sentiment': {'polarity': 'neutral', 'confidence': 0.58}, 'overall_prominence': 0.02, 'overall_frequency': 1, 'body': {'sentiment': {'polarity': 'neutral', 'confidence': 0.58}, 'surface_forms': [{'text': 'FDIC', 'frequency': 1, 'mentions': [{'index': {'start': 4341, 'end': 4345}, 'sentiment': {'polarity': 'neutral', 'confidence': 0.58}}]}]}}, {'id': 'N26395736417296485523243027993913019533', 'types': ['Human'], 'overall_sentiment': {'polarity': 'neutral', 'confidence': 0.77}, 'overall_prominence': 0.02, 'overall_frequency': 1, 'body': {'sentiment': {'polarity': 'neutral', 'confidence': 0.77}, 'surface_forms': [{'text': 'Print', 'frequency': 1, 'mentions': [{'index': {'start': 2649, 'end': 2654}, 'sentiment': {'polarity': 'neutral', 'confidence': 0.77}}]}]}}, {'id': 'N278060561849194082949026571778617539107', 'types': ['Organization'], 'overall_sentiment': {'polarity': 'neutral', 'confidence': 0.94}, 'overall_prominence': 0.02, 'overall_frequency': 1, 'body': {'sentiment': {'polarity': 'neutral', 'confidence': 0.94}, 'surface_forms': [{'text': 'FITB', 'frequency': 1, 'mentions': [{'index': {'start': 4188, 'end': 4192}, 'sentiment': {'polarity': 'neutral', 'confidence': 0.94}}]}]}}, {'id': 'Q1114148', 'links': {'wikipedia': 'https://en.wikipedia.org/wiki/Comerica', 'wikidata': 'https://www.wikidata.org/wiki/Q1114148'}, 'stock_tickers': ['CMA'], 'types': ['Financial_institution', 'Bank', 'Business', 'Organization'], 'overall_sentiment': {'polarity': 'neutral', 'confidence': 0.74}, 'overall_prominence': 0.02, 'overall_frequency': 1, 'body': {'sentiment': {'polarity': 'neutral', 'confidence': 0.74}, 'surface_forms': [{'text': 'Comerica Bank', 'frequency': 1, 'mentions': [{'index': {'start': 1260, 'end': 1273}, 'sentiment': {'polarity': 'neutral', 'confidence': 0.74}}]}]}}, {'id': 'N128975154855409579369489834079504525994', 'types': ['Organization'], 'overall_sentiment': {'polarity': 'neutral', 'confidence': 0.89}, 'overall_prominence': 0.02, 'overall_frequency': 1, 'body': {'sentiment': {'polarity': 'neutral', 'confidence': 0.89}, 'surface_forms': [{'text': 'Corporate Banking', 'frequency': 1, 'mentions': [{'index': {'start': 1518, 'end': 1535}, 'sentiment': {'polarity': 'neutral', 'confidence': 0.89}}]}]}}, {'id': 'Q1278221', 'links': {'wikipedia': 'https://en.wikipedia.org/wiki/Eastern_Michigan_University', 'wikidata': 'https://www.wikidata.org/wiki/Q1278221'}, 'types': ['Educational_organization', 'Location', 'Organization'], 'overall_sentiment': {'polarity': 'neutral', 'confidence': 0.94}, 'overall_prominence': 0.02, 'overall_frequency': 1, 'body': {'sentiment': {'polarity': 'neutral', 'confidence': 0.94}, 'surface_forms': [{'text': 'Eastern Michigan', 'frequency': 1, 'mentions': [{'index': {'start': 932, 'end': 948}, 'sentiment': {'polarity': 'neutral', 'confidence': 0.94}}]}]}}, {'id': 'N218900062699956768170366226177763888652', 'types': ['Organization'], 'overall_sentiment': {'polarity': 'neutral', 'confidence': 0.89}, 'overall_prominence': 0.02, 'overall_frequency': 1, 'body': {'sentiment': {'polarity': 'neutral', 'confidence': 0.89}, 'surface_forms': [{'text': 'Business Banking', 'frequency': 1, 'mentions': [{'index': {'start': 979, 'end': 995}, 'sentiment': {'polarity': 'neutral', 'confidence': 0.89}}]}]}}, {'id': 'N122327692083662896914866533269013965931', 'types': ['Location'], 'overall_sentiment': {'polarity': 'positive', 'confidence': 0.64}, 'overall_prominence': 0.02, 'overall_frequency': 1, 'body': {'sentiment': {'polarity': 'positive', 'confidence': 0.64}, 'surface_forms': [{'text': 'U.S', 'frequency': 1, 'mentions': [{'index': {'start': 3633, 'end': 3636}, 'sentiment': {'polarity': 'positive', 'confidence': 0.64}}]}]}}, {'id': 'N338249745120364893915741214903779433124', 'types': ['Organization'], 'overall_sentiment': {'polarity': 'neutral', 'confidence': 0.9}, 'overall_prominence': 0.02, 'overall_frequency': 1, 'body': {'sentiment': {'polarity': 'neutral', 'confidence': 0.9}, 'surface_forms': [{'text': 'Fifth Third Foundation', 'frequency': 1, 'mentions': [{'index': {'start': 692, 'end': 714}, 'sentiment': {'polarity': 'neutral', 'confidence': 0.9}}]}]}}, {'id': 'Q1520439', 'links': {'wikipedia': 'https://en.wikipedia.org/wiki/Commercial_property', 'wikidata': 'https://www.wikidata.org/wiki/Q1520439'}, 'overall_sentiment': {'polarity': 'neutral', 'confidence': 0.89}, 'overall_prominence': 0.02, 'overall_frequency': 1, 'body': {'sentiment': {'polarity': 'neutral', 'confidence': 0.89}, 'surface_forms': [{'text': 'Commercial Real Estate', 'frequency': 1, 'mentions': [{'index': {'start': 1537, 'end': 1559}, 'sentiment': {'polarity': 'neutral', 'confidence': 0.89}}]}]}}, {'id': 'Q171892', 'links': {'wikipedia': 'https://en.wikipedia.org/wiki/Lavandula', 'wikidata': 'https://www.wikidata.org/wiki/Q171892'}, 'overall_sentiment': {'polarity': 'neutral', 'confidence': 0.88}, 'overall_prominence': 0.02, 'overall_frequency': 1, 'body': {'sentiment': {'polarity': 'neutral', 'confidence': 0.88}, 'surface_forms': [{'text': 'Lavender', 'frequency': 1, 'mentions': [{'index': {'start': 1422, 'end': 1430}, 'sentiment': {'polarity': 'neutral', 'confidence': 0.88}}]}]}}, {'id': 'Q12439', 'links': {'wikipedia': 'https://en.wikipedia.org/wiki/Detroit', 'wikidata': 'https://www.wikidata.org/wiki/Q12439'}, 'types': ['Corporation', 'Government', 'Organization', 'City', 'Company', 'Local_government', 'Community', 'Political_organisation', 'Location'], 'overall_sentiment': {'polarity': 'neutral', 'confidence': 0.76}, 'overall_prominence': 0.02, 'overall_frequency': 1, 'body': {'sentiment': {'polarity': 'neutral', 'confidence': 0.76}, 'surface_forms': [{'text': 'Detroit', 'frequency': 1, 'mentions': [{'index': {'start': 1277, 'end': 1284}, 'sentiment': {'polarity': 'neutral', 'confidence': 0.76}}]}]}}, {'id': 'N249225933987928815812879274809947927665', 'types': ['Organization'], 'overall_sentiment': {'polarity': 'neutral', 'confidence': 0.88}, 'overall_prominence': 0.02, 'overall_frequency': 1, 'body': {'sentiment': {'polarity': 'neutral', 'confidence': 0.88}, 'surface_forms': [{'text': 'Commercial Banking', 'frequency': 1, 'mentions': [{'index': {'start': 1386, 'end': 1404}, 'sentiment': {'polarity': 'neutral', 'confidence': 0.88}}]}]}}, {'id': 'N9694831903892821175856899713522643033', 'types': ['Organization'], 'overall_sentiment': {'polarity': 'positive', 'confidence': 0.98}, 'overall_prominence': 0.02, 'overall_frequency': 1, 'body': {'sentiment': {'polarity': 'positive', 'confidence': 0.98}, 'surface_forms': [{'text': 'SunTrust Bank Inc', 'frequency': 1, 'mentions': [{'index': {'start': 2298, 'end': 2315}, 'sentiment': {'polarity': 'positive', 'confidence': 0.98}}]}]}}, {'id': 'N14547301626253584228953763286034254933', 'types': ['Organization'], 'overall_sentiment': {'polarity': 'neutral', 'confidence': 0.78}, 'overall_prominence': 0.02, 'overall_frequency': 1, 'body': {'sentiment': {'polarity': 'neutral', 'confidence': 0.78}, 'surface_forms': [{'text': 'Provide Inc. Gibson', 'frequency': 1, 'mentions': [{'index': {'start': 1218, 'end': 1237}, 'sentiment': {'polarity': 'neutral', 'confidence': 0.78}}]}]}}, {'id': 'N150623145095529098263832277729688890077', 'types': ['Organization'], 'overall_sentiment': {'polarity': 'neutral', 'confidence': 0.87}, 'overall_prominence': 0.02, 'overall_frequency': 1, 'body': {'sentiment': {'polarity': 'neutral', 'confidence': 0.87}, 'surface_forms': [{'text': 'MediSphere Health Partners Inc', 'frequency': 1, 'mentions': [{'index': {'start': 2193, 'end': 2223}, 'sentiment': {'polarity': 'neutral', 'confidence': 0.87}}]}]}}, {'id': 'Q648666', 'links': {'wikipedia': 'https://en.wikipedia.org/wiki/United_States_Department_of_the_Treasury', 'wikidata': 'https://www.wikidata.org/wiki/Q648666'}, 'types': ['Government_agency', 'Organization'], 'overall_sentiment': {'polarity': 'neutral', 'confidence': 0.88}, 'overall_prominence': 0.02, 'overall_frequency': 1, 'body': {'sentiment': {'polarity': 'neutral', 'confidence': 0.88}, 'surface_forms': [{'text': 'Treasury', 'frequency': 1, 'mentions': [{'index': {'start': 1600, 'end': 1608}, 'sentiment': {'polarity': 'neutral', 'confidence': 0.88}}]}]}}, {'id': 'N85624499520561609055117557020157308140', 'types': ['Organization'], 'overall_sentiment': {'polarity': 'positive', 'confidence': 0.98}, 'overall_prominence': 0.02, 'overall_frequency': 1, 'body': {'sentiment': {'polarity': 'positive', 'confidence': 0.98}, 'surface_forms': [{'text': 'Publisher of Savoy Magazine', 'frequency': 1, 'mentions': [{'index': {'start': 2339, 'end': 2366}, 'sentiment': {'polarity': 'positive', 'confidence': 0.98}}]}]}}, {'id': 'N239432010123429701067303114178897697028', 'types': ['Organization'], 'overall_sentiment': {'polarity': 'neutral', 'confidence': 0.93}, 'overall_prominence': 0.02, 'overall_frequency': 1, 'body': {'sentiment': {'polarity': 'neutral', 'confidence': 0.93}, 'surface_forms': [{'text': 'Global Select Market', 'frequency': 1, 'mentions': [{'index': {'start': 4149, 'end': 4169}, 'sentiment': {'polarity': 'neutral', 'confidence': 0.93}}]}]}}, {'id': 'Q82059', 'links': {'wikipedia': 'https://en.wikipedia.org/wiki/Nasdaq', 'wikidata': 'https://www.wikidata.org/wiki/Q82059'}, 'types': ['Stock_exchange', 'Organization'], 'overall_sentiment': {'polarity': 'neutral', 'confidence': 0.93}, 'overall_prominence': 0.02, 'overall_frequency': 1, 'body': {'sentiment': {'polarity': 'neutral', 'confidence': 0.93}, 'surface_forms': [{'text': 'NASDAQ', 'frequency': 1, 'mentions': [{'index': {'start': 4141, 'end': 4147}, 'sentiment': {'polarity': 'neutral', 'confidence': 0.93}}]}]}}, {'id': 'N23962544145411301843279744395973936672', 'types': ['Organization'], 'overall_sentiment': {'polarity': 'neutral', 'confidence': 0.88}, 'overall_prominence': 0.02, 'overall_frequency': 1, 'body': {'sentiment': {'polarity': 'neutral', 'confidence': 0.88}, 'surface_forms': [{'text': 'Specialty Lending', 'frequency': 1, 'mentions': [{'index': {'start': 1578, 'end': 1595}, 'sentiment': {'polarity': 'neutral', 'confidence': 0.88}}]}]}}, {'id': 'Q16837348', 'links': {'wikipedia': 'https://en.wikipedia.org/wiki/Ethisphere_Institute', 'wikidata': 'https://www.wikidata.org/wiki/Q16837348'}, 'overall_sentiment': {'polarity': 'positive', 'confidence': 0.75}, 'overall_prominence': 0.02, 'overall_frequency': 1, 'body': {'sentiment': {'polarity': 'positive', 'confidence': 0.75}, 'surface_forms': [{'text': 'Ethisphere', 'frequency': 1, 'mentions': [{'index': {'start': 3675, 'end': 3685}, 'sentiment': {'polarity': 'positive', 'confidence': 0.75}}]}]}}, {'id': 'N227597391773557728581809308536433954796', 'types': ['Organization'], 'overall_sentiment': {'polarity': 'neutral', 'confidence': 0.79}, 'overall_prominence': 0.02, 'overall_frequency': 1, 'body': {'sentiment': {'polarity': 'neutral', 'confidence': 0.79}, 'surface_forms': [{'text': 'Inclusion and Diversity and Sustainability', 'frequency': 1, 'mentions': [{'index': {'start': 617, 'end': 659}, 'sentiment': {'polarity': 'neutral', 'confidence': 0.79}}]}]}}, {'id': 'N326530939984644940132034392477203740662', 'types': ['Organization'], 'overall_sentiment': {'polarity': 'positive', 'confidence': 0.72}, 'overall_prominence': 0.02, 'overall_frequency': 1, 'body': {'sentiment': {'polarity': 'positive', 'confidence': 0.72}, 'surface_forms': [{'text': 'World', 'frequency': 1, 'mentions': [{'index': {'start': 3688, 'end': 3693}, 'sentiment': {'polarity': 'positive', 'confidence': 0.72}}]}]}}]","['#FifthThirdBank', '#CommercialBank', '#VerticalIntegration', '#Tennessee', '#SunTrustBanks', '#Savoy', '#RaceAndEthnicityInTheUnitedStatesCensus', '#Paycheck', '#NASDAQ', '#NASDAQ', '#HealthCare', '#Force', '#FinancialServices', '#FederalDepositInsuranceCorporation', '#EasternMichiganUniversity', '#Division', '#Detroit', '#CorporateSocialResponsibility', '#CorporateFinance', '#CommunityReinvestmentAct', '#CommonStock', '#Comerica', '#Citizenship', '#Cincinnati', '#CINCINNATI', '#Bank']",6729244360,"['Magazine', 'Paycheck', 'corporate responsibility', 'SunTrust Bank', 'African American', 'Eastern Michigan', 'division', 'Specialty Lending', 'Gibson', 'Recognized', 'Fifth Third', 'Third', 'NASDAQ', 'Corporate America', 'World', 'corporate finance', 'bank', 'Business Banking', 'citizenship', 'Ethisphere', 'Print', 'Comerica Bank', 'Commercial Banking', 'Savoy', 'CINCINNATI', 'health care', 'Treasury', 'Savoy Magazine', 'vertically integrated', 'Detroit', 'MENAFN', 'Lavender', 'SavoyNetwork', 'Kevin Lavender', 'Corporate Banking', 'U.S', 'Influential Executives', 'corporate', 'Banking', 'FDIC', 'Fifth', 'L.P. Green', 'financial services', 'National Association', 'Tennessee', 'credit', 'Bank', 'Member FDIC', 'II', 'FITB', 'Kala Gibson', 'common stock', 'commercial banking']",en,"{'permalink': 'https://menafn.com/1108134194/Fifth-Thirds-Kala-Gibson-Kevin-Lavender-Recognized-As-2024-Most-Influential-Executives-In-Corporate-America', 'clusters': '/stories?clusters[]=580339897'}",14,2024-04-24T18:56:28Z,33,"{'body': {'polarity': 'neutral', 'score': 0.52}, 'title': {'polarity': 'neutral', 'score': 0.47}}","{'domain': 'menafn.com', 'home_page_url': 'https://www.menafn.com/', 'id': 3677, 'locations': [{'country': 'JO'}, {'city': 'Dubai', 'country': 'AE', 'state': 'Dubai'}], 'name': 'MENAFN', 'rankings': {'alexa': [{'fetched_at': '2020-06-22T11:33:07.605467635Z', 'rank': 30870}, {'country': 'IN', 'fetched_at': '2020-06-22T11:33:07.605467635Z', 'rank': 8795}, {'country': 'KW', 'fetched_at': '2020-06-22T11:33:07.605467635Z', 'rank': 2179}, {'country': 'EG', 'fetched_at': '2020-06-22T11:33:07.605467635Z', 'rank': 6496}, {'country': 'BD', 'fetched_at': '2020-06-22T11:33:07.605467635Z', 'rank': 18048}, {'country': 'TR', 'fetched_at': '2020-06-22T11:33:07.605467635Z', 'rank': 75485}, {'country': 'JO', 'fetched_at': '2020-06-22T11:33:07.605467635Z', 'rank': 956}, {'country': 'PK', 'fetched_at': '2020-06-22T11:33:07.605467635Z', 'rank': 16770}, {'country': 'US', 'fetched_at': '2020-06-22T11:33:07.605467635Z', 'rank': 61325}, {'country': 'IR', 'fetched_at': '2020-06-22T11:33:07.605467635Z', 'rank': 64596}, {'country': 'SA', 'fetched_at': '2020-06-22T11:33:07.605467635Z', 'rank': 10564}, {'country': 'AE', 'fetched_at': '2020-06-22T11:33:07.605467635Z', 'rank': 4447}, {'country': 'RS', 'fetched_at': '2020-06-22T11:33:07.605467635Z', 'rank': 11959}, {'country': 'LK', 'fetched_at': '2020-06-22T11:33:07.605467635Z', 'rank': 3992}, {'country': 'QA', 'fetched_at': '2020-06-22T11:33:07.605467635Z', 'rank': 1907}, {'country': 'CA', 'fetched_at': '2020-06-22T11:33:07.605467635Z', 'rank': 40997}]}, 'scopes': [{'city': 'Aligarh', 'country': 'IN', 'state': 'Uttar Pradesh'}]}","{'sentences': [""MENAFN - 3BL) CINCINNATI, April 24, 2024 /3BL/ - Fifth Third Bank's Kala Gibson, chief corporate responsibility officer, and Kevin P.\nLavender, head of commercial banking, have been named to Savoy Magazine's 2024 Most Influential Executives in Corporate America list."", 'He began his career as group vice president for health care lending with SunTrust Bank Inc.\n  L.P. Green, II, the Publisher of Savoy Magazine, expressed his enthusiasm: ""As we celebrate our 23rd anniversary, it\'s an honor to spotlight such extraordinary individuals in our 2024 edition.', 'He joined Fifth Third in 2005 as senior vice president and head of national corporate health care lending.', ""In 2020, he led the bank's Paycheck Protection Program lending and in 2021 led the acquisition of Provide Inc. Gibson started his career at Comerica Bank in Detroit and has more than 30 years of experience in business banking and credit administration.\n  "", ""As Head of Commercial Banking for Fifth Third, Lavender is responsible for overseeing the Bank's vertically integrated commercial sales teams, Corporate Banking, Commercial Real Estate, Capital Markets, Specialty Lending and Treasury Management businesses.""]}","Fifth Third's Kala Gibson, Kevin Lavender Recognized As 2024 Most Influential Executives In Corporate America",668,0,"[{'height': 627, 'url': 'https://menafn.com/updates/pr/2024-04/24/3_27d3aimage_story.jpg', 'width': 1200}, {'height': 100, 'url': 'https://menafn.com/Updates/index/HTML_Images/NewsEN_MostPopular_img_1.jpg?490538', 'width': 133}, {'height': 100, 'url': 'https://menafn.com/Updates/index/HTML_Images/NewsEN_MostPopular_img_2.jpg?849343', 'width': 150}, {'height': 100, 'url': 'https://menafn.com/Updates/index/HTML_Images/NewsEN_MostPopular_img_3.jpg?44528', 'width': 213}, {'height': 100, 'url': 'https://menafn.com/Updates/index/HTML_Images/NewsEN_MostPopular_img_4.jpg?403333', 'width': 133}, {'height': 100, 'url': 'https://menafn.com/Updates/index/HTML_Images/NewsEN_MostPopular_img_5.jpg?403333', 'width': 500}, {'height': 100, 'url': 'https://menafn.com/Updates/index/HTML_Images/NewsEN_MostPopular_img_6.jpg?762138', 'width': 181}, {'height': 250, 'url': 'https://menafn.com/Updates/index/HTML_Images/NewsEn_MoreStories_img_1.jpg?687247', 'width': 444}, {'height': 250, 'url': 'https://menafn.com/Updates/index/HTML_Images/NewsEn_MoreStories_img_2.jpg?262011', 'width': 444}, {'height': 250, 'url': 'https://menafn.com/Updates/index/HTML_Images/NewsEn_MoreStories_img_3.jpg?596739', 'width': 444}, {'height': 250, 'url': 'https://menafn.com/Updates/index/HTML_Images/NewsEn_MoreStories_img_4.jpg?150729', 'width': 444}, {'height': 250, 'url': 'https://menafn.com/Updates/index/HTML_Images/NewsEn_MoreStories_img_5.jpg?258709', 'width': 444}, {'height': 250, 'url': 'https://menafn.com/Updates/index/HTML_Images/NewsEn_MoreStories_img_6.jpg?171504', 'width': 333}, {'height': 249, 'url': 'https://menafn.com/Updates/index/HTML_Images/NewsEn_MoreStories_img_7.jpg?561873', 'width': 373}, {'height': 250, 'url': 'https://menafn.com/Updates/index/HTML_Images/NewsEn_MoreStories_img_8.jpg?474668', 'width': 229}, {'height': 250, 'url': 'https://menafn.com/Updates/index/HTML_Images/NewsEn_MoreStories_img_9.jpg?506232', 'width': 416}, {'height': 249, 'url': 'https://menafn.com/Updates/index/HTML_Images/NewsEn_MoreStories_img_10.jpg?60222', 'width': 401}, {'height': 250, 'url': 'https://menafn.com/Updates/index/HTML_Images/NewsEn_MoreStories_img_11.jpg?777832', 'width': 444}, {'height': 250, 'url': 'https://menafn.com/Updates/index/HTML_Images/NewsEn_MoreStories_img_12.jpg?168202', 'width': 312}]"
