author,body,categories,industries,characters_count,clusters,entities,hashtags,id,keywords,language,links,paragraphs_count,published_at,sentences_count,sentiment,source,summary,title,words_count,license_type,media
"{'id': 944648, 'name': 'Mickey Rousseau'}","Fifth Third Bancorp (NASDAQ:FITBO – Get Free Report) shares were up 1.3% during trading on Monday . The company traded as high as $21.95 and last traded at $21.87. Approximately 4,422 shares traded hands during mid-day trading, a decline of 68% from the average daily volume of 13,907 shares. The stock had previously closed at $21.59.

Fifth Third Bancorp Price Performance

The stock’s 50-day moving average is $22.98 and its 200 day moving average is $22.22.

Get Fifth Third Bancorp alerts:

Fifth Third Bancorp Dividend Announcement

The business also recently announced a quarterly dividend, which was paid on Monday, April 1st. Investors of record on Thursday, March 28th were paid a $0.3094 dividend. This represents a $1.24 dividend on an annualized basis and a yield of 5.62%. The ex-dividend date was Wednesday, March 27th.

About Fifth Third Bancorp

Fifth Third Bancorp operates as the bank holding company for Fifth Third Bank, National Association that engages in the provision of a range of financial products and services in the United States. It operates through three segments: Commercial Banking, Consumer and Small Business Banking, and Wealth and Asset Management.

Recommended Stories

Receive News & Ratings for Fifth Third Bancorp Daily - Enter your email address below to receive a concise daily summary of the latest news and analysts' ratings for Fifth Third Bancorp and related companies with MarketBeat.com's FREE daily email newsletter.","[{'id': 'IAB13', 'label': 'Personal Finance', 'score': 0.43, 'links': {'self': 'https://api.aylien.com/api/v1/classify/taxonomy/iab-qag/IAB13'}}, {'id': 'IAB13-11', 'label': 'Stocks', 'score': 0.24, 'links': {'parents': ['https://api.aylien.com/api/v1/classify/taxonomy/iab-qag/IAB13'], 'self': 'https://api.aylien.com/api/v1/classify/taxonomy/iab-qag/IAB13-11'}}, {'id': '04000000', 'label': 'economy, business and finance', 'score': 0.08, 'links': {'self': 'https://api.aylien.com/api/v1/classify/taxonomy/iptc-subjectcode/04000000'}}, {'id': '04006000', 'label': 'financial and business service', 'score': 0.08, 'links': {'parents': ['https://api.aylien.com/api/v1/classify/taxonomy/iptc-subjectcode/04000000'], 'self': 'https://api.aylien.com/api/v1/classify/taxonomy/iptc-subjectcode/04006000'}}, {'id': '04006002', 'label': 'banking', 'score': 0.08, 'links': {'parents': ['https://api.aylien.com/api/v1/classify/taxonomy/iptc-subjectcode/04006000'], 'self': 'https://api.aylien.com/api/v1/classify/taxonomy/iptc-subjectcode/04006002'}}, {'id': 'ay.biz', 'label': 'Business and Commerce', 'score': 1, 'links': {'self': 'https://api.aylien.com/api/v1/classify/taxonomy/aylien/ay.biz'}}, {'id': 'ay.fin', 'label': 'Finance', 'score': 1, 'links': {'self': 'https://api.aylien.com/api/v1/classify/taxonomy/aylien/ay.fin'}}, {'id': 'ay.fin.markets', 'label': 'Market News and Updates', 'score': 1, 'links': {'parents': ['https://api.aylien.com/api/v1/classify/taxonomy/aylien/ay.fin'], 'self': 'https://api.aylien.com/api/v1/classify/taxonomy/aylien/ay.fin.markets'}}, {'id': 'ay.fin.stkmoves', 'label': 'Stock Price Updates', 'score': 1, 'links': {'parents': ['https://api.aylien.com/api/v1/classify/taxonomy/aylien/ay.fin.markets'], 'self': 'https://api.aylien.com/api/v1/classify/taxonomy/aylien/ay.fin.stkmoves'}}, {'id': 'ay.fin.stkrise', 'label': 'Rising Stock Price', 'score': 1, 'links': {'parents': ['https://api.aylien.com/api/v1/classify/taxonomy/aylien/ay.fin.stkmoves'], 'self': 'https://api.aylien.com/api/v1/classify/taxonomy/aylien/ay.fin.stkrise'}}, {'id': 'ay.fin.invest', 'label': 'Investments', 'score': 0.9, 'links': {'parents': ['https://api.aylien.com/api/v1/classify/taxonomy/aylien/ay.fin'], 'self': 'https://api.aylien.com/api/v1/classify/taxonomy/aylien/ay.fin.invest'}}, {'id': 'ay.fin.stocks', 'label': 'Stocks', 'score': 0.9, 'links': {'parents': ['https://api.aylien.com/api/v1/classify/taxonomy/aylien/ay.fin.invest'], 'self': 'https://api.aylien.com/api/v1/classify/taxonomy/aylien/ay.fin.stocks'}}]","[{'id': 'in.finserv', 'label': 'Financial Services and Banking', 'score': 1, 'links': {'self': 'https://api.aylien.com/api/v1/classify/taxonomy/industries/in.finserv'}}, {'id': 'in.finserv.banking', 'label': 'Banks and Banking', 'score': 1, 'links': {'parents': ['https://api.aylien.com/api/v1/classify/taxonomy/industries/in.finserv.lending'], 'self': 'https://api.aylien.com/api/v1/classify/taxonomy/industries/in.finserv.banking'}}, {'id': 'in.finserv.lending', 'label': 'Lending', 'score': 1, 'links': {'parents': ['https://api.aylien.com/api/v1/classify/taxonomy/industries/in.finserv'], 'self': 'https://api.aylien.com/api/v1/classify/taxonomy/industries/in.finserv.lending'}}]",1449,[578801859],"[{'id': 'Q1411810', 'links': {'wikipedia': 'https://en.wikipedia.org/wiki/Fifth_Third_Bank', 'wikidata': 'https://www.wikidata.org/wiki/Q1411810'}, 'stock_tickers': ['FITB'], 'types': ['Financial_institution', 'Bank', 'Organization', 'Business'], 'overall_sentiment': {'polarity': 'neutral', 'confidence': 0.9}, 'overall_prominence': 0.98, 'overall_frequency': 10, 'body': {'sentiment': {'polarity': 'neutral', 'confidence': 0.9}, 'surface_forms': [{'text': 'Fifth Third Bancorp', 'frequency': 8, 'mentions': [{'index': {'start': 0, 'end': 19}, 'sentiment': {'polarity': 'positive', 'confidence': 0.66}}, {'index': {'start': 337, 'end': 356}, 'sentiment': {'polarity': 'neutral', 'confidence': 0.84}}, {'index': {'start': 467, 'end': 486}, 'sentiment': {'polarity': 'neutral', 'confidence': 0.88}}, {'index': {'start': 496, 'end': 515}, 'sentiment': {'polarity': 'neutral', 'confidence': 0.88}}, {'index': {'start': 842, 'end': 861}, 'sentiment': {'polarity': 'neutral', 'confidence': 0.94}}, {'index': {'start': 863, 'end': 882}, 'sentiment': {'polarity': 'neutral', 'confidence': 0.95}}, {'index': {'start': 1236, 'end': 1255}, 'sentiment': {'polarity': 'neutral', 'confidence': 0.91}}, {'index': {'start': 1375, 'end': 1394}, 'sentiment': {'polarity': 'neutral', 'confidence': 0.91}}]}, {'text': 'Fifth Third Bank', 'frequency': 1, 'mentions': [{'index': {'start': 924, 'end': 940}, 'sentiment': {'polarity': 'neutral', 'confidence': 0.94}}]}]}, 'title': {'sentiment': {'polarity': 'positive', 'confidence': 0.52}, 'surface_forms': [{'text': 'Fifth Third Bancorp', 'frequency': 1, 'mentions': [{'index': {'start': 0, 'end': 19}, 'sentiment': {'polarity': 'positive', 'confidence': 0.52}}]}]}}, {'id': 'N167468656551271266208668545617136558240', 'types': ['Organization'], 'overall_sentiment': {'polarity': 'positive', 'confidence': 0.64}, 'overall_prominence': 0.98, 'overall_frequency': 2, 'body': {'sentiment': {'polarity': 'positive', 'confidence': 0.64}, 'surface_forms': [{'text': 'NASDAQ', 'frequency': 1, 'mentions': [{'index': {'start': 21, 'end': 27}, 'sentiment': {'polarity': 'positive', 'confidence': 0.64}}]}]}, 'title': {'sentiment': {'polarity': 'neutral', 'confidence': 0.52}, 'surface_forms': [{'text': 'NASDAQ', 'frequency': 1, 'mentions': [{'index': {'start': 21, 'end': 27}, 'sentiment': {'polarity': 'neutral', 'confidence': 0.52}}]}]}}, {'id': 'N57815814891964075554913725823301805533', 'types': ['Organization'], 'overall_sentiment': {'polarity': 'positive', 'confidence': 0.6}, 'overall_prominence': 0.98, 'overall_frequency': 2, 'body': {'sentiment': {'polarity': 'positive', 'confidence': 0.68}, 'surface_forms': [{'text': 'FITBO', 'frequency': 1, 'mentions': [{'index': {'start': 28, 'end': 33}, 'sentiment': {'polarity': 'positive', 'confidence': 0.68}}]}]}, 'title': {'sentiment': {'polarity': 'positive', 'confidence': 0.51}, 'surface_forms': [{'text': 'FITBO', 'frequency': 1, 'mentions': [{'index': {'start': 28, 'end': 33}, 'sentiment': {'polarity': 'positive', 'confidence': 0.51}}]}]}}, {'id': 'N248456574704364846200703492439041640765', 'types': ['Organization'], 'overall_sentiment': {'polarity': 'positive', 'confidence': 0.7}, 'overall_prominence': 0.87, 'overall_frequency': 1, 'body': {'sentiment': {'polarity': 'positive', 'confidence': 0.7}, 'surface_forms': [{'text': 'Get Free Report', 'frequency': 1, 'mentions': [{'index': {'start': 36, 'end': 51}, 'sentiment': {'polarity': 'positive', 'confidence': 0.7}}]}]}}, {'id': 'N249225933987928815812879274809947927665', 'types': ['Organization'], 'overall_sentiment': {'polarity': 'neutral', 'confidence': 0.89}, 'overall_prominence': 0.02, 'overall_frequency': 1, 'body': {'sentiment': {'polarity': 'neutral', 'confidence': 0.89}, 'surface_forms': [{'text': 'Commercial Banking', 'frequency': 1, 'mentions': [{'index': {'start': 1097, 'end': 1115}, 'sentiment': {'polarity': 'neutral', 'confidence': 0.89}}]}]}}, {'id': 'N62116731977855039571860121484779769989', 'types': ['Organization'], 'overall_sentiment': {'polarity': 'neutral', 'confidence': 0.91}, 'overall_prominence': 0.02, 'overall_frequency': 1, 'body': {'sentiment': {'polarity': 'neutral', 'confidence': 0.91}, 'surface_forms': [{'text': 'Receive News & Ratings', 'frequency': 1, 'mentions': [{'index': {'start': 1209, 'end': 1231}, 'sentiment': {'polarity': 'neutral', 'confidence': 0.91}}]}]}}, {'id': 'Q30', 'links': {'wikipedia': 'https://en.wikipedia.org/wiki/United_States', 'wikidata': 'https://www.wikidata.org/wiki/Q30'}, 'types': ['Country', 'Community', 'Sovereign_state', 'State_(polity)', 'Location', 'Organization'], 'overall_sentiment': {'polarity': 'neutral', 'confidence': 0.94}, 'overall_prominence': 0.02, 'overall_frequency': 1, 'body': {'sentiment': {'polarity': 'neutral', 'confidence': 0.94}, 'surface_forms': [{'text': 'United States', 'frequency': 1, 'mentions': [{'index': {'start': 1046, 'end': 1059}, 'sentiment': {'polarity': 'neutral', 'confidence': 0.94}}]}]}}, {'id': 'N307786731444547655846320897934824127753', 'types': ['Organization'], 'overall_sentiment': {'polarity': 'neutral', 'confidence': 0.88}, 'overall_prominence': 0.02, 'overall_frequency': 1, 'body': {'sentiment': {'polarity': 'neutral', 'confidence': 0.88}, 'surface_forms': [{'text': 'Wealth and Asset Management', 'frequency': 1, 'mentions': [{'index': {'start': 1158, 'end': 1185}, 'sentiment': {'polarity': 'neutral', 'confidence': 0.88}}]}]}}, {'id': 'Q1966945', 'links': {'wikipedia': 'https://en.wikipedia.org/wiki/National_Association_of_Professional_Base_Ball_Players', 'wikidata': 'https://www.wikidata.org/wiki/Q1966945'}, 'types': ['Organization'], 'overall_sentiment': {'polarity': 'neutral', 'confidence': 0.94}, 'overall_prominence': 0.02, 'overall_frequency': 1, 'body': {'sentiment': {'polarity': 'neutral', 'confidence': 0.94}, 'surface_forms': [{'text': 'National Association', 'frequency': 1, 'mentions': [{'index': {'start': 942, 'end': 962}, 'sentiment': {'polarity': 'neutral', 'confidence': 0.94}}]}]}}, {'id': 'N78659012698712180707963503507584220034', 'types': ['Organization'], 'overall_sentiment': {'polarity': 'neutral', 'confidence': 0.92}, 'overall_prominence': 0.02, 'overall_frequency': 1, 'body': {'sentiment': {'polarity': 'neutral', 'confidence': 0.92}, 'surface_forms': [{'text': 'MarketBeat.com', 'frequency': 1, 'mentions': [{'index': {'start': 1422, 'end': 1436}, 'sentiment': {'polarity': 'neutral', 'confidence': 0.92}}]}]}}, {'id': 'N138525436135908215604280004237953177419', 'types': ['Organization'], 'overall_sentiment': {'polarity': 'neutral', 'confidence': 0.88}, 'overall_prominence': 0.02, 'overall_frequency': 1, 'body': {'sentiment': {'polarity': 'neutral', 'confidence': 0.88}, 'surface_forms': [{'text': 'Consumer and Small Business Banking', 'frequency': 1, 'mentions': [{'index': {'start': 1117, 'end': 1152}, 'sentiment': {'polarity': 'neutral', 'confidence': 0.88}}]}]}}]","['#FifthThirdBank', '#NASDAQ', '#NASDAQ', '#Dividend', '#UnitedStates', '#NielsenRatings', '#MovingAverage', '#MidDay', '#CommercialBank', '#BankHoldingCompany']",6730224506,"['Business Banking', 'moving average', 'Commercial Banking', 'Dividend', 'Fifth', 'shares', 'Banking', 'ratings', 'March', 'United States', 'NASDAQ', 'Third', 'mid-day', 'daily', 'dividend', 'Bancorp', 'MarketBeat.com', 'FITBO', 'Monday']",en,"{'permalink': 'https://www.dispatchtribunal.com/2024/04/24/fifth-third-bancorp-nasdaqfitbo-stock-price-up-1-3.html', 'clusters': '/stories?clusters[]=578801859'}",10,2024-04-25T02:38:17Z,10,"{'body': {'polarity': 'negative', 'score': 0.9}, 'title': {'polarity': 'neutral', 'score': 0.78}}","{'domain': 'dispatchtribunal.com', 'home_page_url': 'https://www.dispatchtribunal.com/', 'id': 3725, 'locations': [{'country': 'US'}], 'name': 'Dispatch Tribunal', 'rankings': {'alexa': [{'fetched_at': '2020-06-22T11:42:15.562942145Z', 'rank': 1283137}]}, 'scopes': [{}]}","{'sentences': ['Fifth Third Bancorp (NASDAQ:FITBO – Get Free Report) shares were up 1.3% during trading on Monday .', 'Get Fifth Third Bancorp alerts:\n\nFifth Third Bancorp Dividend Announcement\n\nThe business also recently announced a quarterly dividend, which was paid on Monday, April 1st.', ""Recommended Stories\n\nReceive News & Ratings for Fifth Third Bancorp Daily - Enter your email address below to receive a concise daily summary of the latest news and analysts' ratings for Fifth Third Bancorp and related companies with MarketBeat.com's FREE daily email newsletter."", 'Fifth Third Bancorp Price Performance\n\nThe stock’s 50-day moving average is $22.98 and its 200 day moving average is $22.22.\n\n', 'About Fifth Third Bancorp\n\nFifth Third Bancorp operates as the bank holding company for Fifth Third Bank, National Association that engages in the provision of a range of financial products and services in the United States.']}",Fifth Third Bancorp (NASDAQ:FITBO) Stock Price Up 1.3%,233,0,
